date,school,keyword,article,article_neg,article_pos,article_neu,paragraph_neg,paragraph_pos,paragraph_neu,sentence_neg,sentence_pos,sentence_neu
2009-11-12,AU,conservative,"PHILADELPHIA — Libertarians are a diverse bunch. Some of them wish they could abolish government entirely. Others just want its power reduced. But what unites them is their shared belief that the state should be substantially smaller and do drastically less. 
Here at AU, the libertarians have a club. AU Students For Liberty is a small operation. I’m told that fewer than 20 students attend regular meetings or events. Still, there are few diehards, most of whom I met this past weekend when I traveled with AUSFL to the 2009 Students For Liberty Mid-Atlantic Conference. The event took place at Drexel University, smack dab in the middle of the Cradle of Liberty itself — Philadelphia. The journey I took there and back again is something I won’t forget soon. It taught me about an alternative governing philosophy, but it also gave me a glimpse at what it’s like to be part of a political counterculture.
Our odyssey began last Friday with a Chinatown bus ride. On the way from D.C. to Philly, I got a primer on libertarian philosophy and policy from a few members of AUSFL. For two hours, I asked hundreds of questions and took furious notes. The young libertarians explained their core principles of nonaggression and self-ownership. They argued that taxation is slavery. They dismissed the entire idea of slicing up the economic pie, saying the solution is simply to make that pie bigger. 
Throughout the conversation, I had several realizations about libertarians. First, many of them don’t love Ron Paul. True libertarians want government out of their lives in every respect, so they don’t understand Paul’s pro-life stance or his opposition to gay marriage. They say the state shouldn’t be involved in any of this.
Second, libertarians disagree amongst themselves — a lot. In fact, it seems to me, based on my little exposure, that there is greater diversity of thought within the libertarian movement than within the conservative or progressive movements. There is a great libertarian debate over just how tiny government should be. A few of them like public education, but most don’t. Many think the government should run the justice system, the military and the police force, but some don’t.
As I learned talking to AU and Drexel students at a mixer late Friday night, there are two main camps within the libertarian movement: the minarchists and the anarcho-capitalists or anarchists. The former advocate extremely limited government. The latter, at least ideally, prefer no government at all.
Learning about anarcho-capitalism shocked me, as I imagine it would shock many people. Certainly, I am familiar with the argument that limited government means more freedom. I get it. It’s compelling. I can conceive of a scenario in which America reverts to the traditions of the Founding generation and structures government simply to provide justice, defense, security and maybe a limited form of welfare. That transformation, which is what minarchists want, would be radical, but it could happen.
What I found unbelievable was that anarcho-capitalists think the Founders’ government was way too big. They have so much faith in capitalism, so much faith in free exchange, that they literally wish for a world where markets make the rules. They philosophically and practically think the state is a problem. Its abolishment, they argue, is the rational endgame of the liberty movement. 
These are radical views. They fly in the face of the Founders’ intent. They’re outside the mainstream of American politics. I think they’re insane and an overwhelming majority of Americans — nearly everyone — would reject them outright. 
The students I talked to know this. They’ve faced reality. None of them wear rose-colored glasses. The minarchists understand government will always be bigger than they’d like and the anarcho-capitalists know they’ll never have the government-free society of their dreams.
At Saturday’s conference, the students and the speakers made mention of these realities. The presenters — college professors, organization leaders and authors — spoke of setting small goals and pushing for incremental change.
I left the conference early, but I stayed long enough to get the gist. I saw Irena Schneider, a sophomore in the School of Public Affairs, give an impassioned speech in her capacity as Mid-Atlantic Director. I saw Eagle columnist Alex Knepper realize he was the moderate in the room. And most importantly, I saw a group of earnest political activists enjoying each other’s company, which is always cool. 
The Students For Liberty may have unconventional views about government, but they’re well within the mainstream as far as how to have a good time. I hardly knew any of them before last weekend, but everyone was accommodating and appreciative of an Eagle writer tagging along.
I had many personal firsts last weekend. I made my first visit to Philly. I ate my first Philly Cheesesteak. And for the first, and likely last time, I saw an apartment full of libertarians sing “Don’t Stop Believing” at the top of their lungs.
“...Some will win, some will lose/Some were born to sing the blues.” 
Sounds like libertarian economics to me.
",0.0,0.222,0.778,0.009,0.154,0.837,0.061,0.185,0.754
2010-03-04,AU,conservative,"Democrats aren’t doing half bad right now. So far 2010 actually isn’t looking nearly as dire as it was just after pseudo-Republican Scott Brown won the Kennedy seat in Massachusetts.
If Democrats keep up the hard work and continue to ignore tea partiers—radical conservatives and ultra-liberals like they have been—they might just survive this year. Nevertheless, here’s a little advice.
Dear Democratic Strategists,
You’re doing alright. Behind all the tea party crazy talk and “Washington is broken” nonsense, the news cycle seems to be trending your way.
Predicting the news cycle is a difficult thing to do. Sometimes it’s rough for Democrats, sometimes it hits the GOP where it really hurts. 
This is supposed to be a rough year for Democrats. President Barack Obama’s policies haven’t sailed through as smoothly as we hoped. Hardly anyone’s happy with Congress, and it consists mostly of Democrats. So it’s all bad news for the Democratic Party, right?
I’m not so sure. Look at the news from Tuesday just this week, for example.
The leading headline in the Wall Street Journal was “Deal Near on Banking Rules,” one of the Democrats’ key policy items. Point for us.
Let’s look at others. “Tea Party Holds Risks for GOP.” Minus one for Republicans.
“Fed Void Clears Path for Obama,” “Manufacturing Shows Strength,” “Bailout Update: AIG’s repayment means U.S. is close to getting back half of its IOUs.” Point, point, point for Democrats.
And then there’s darling Sen. Jim Bunning, R-Ky., holding up unemployment benefits for millions of Americans.
“One Senator Holds Up Bill, in New Level of Gridlock,” proclaims the WSJ. And then Tuesday evening: “Deal Reached to End Senator’s Holdout.” Point.
“Well that’s just one paper!” conservatives might protest (never mind the fact that the Wall Street Journal typically leans right). Sure, but The Washington Post’s headlines tell the same story.
Oh, and see that cover story in the Metro section? It exposes Republican Gov. Bob McDonnell of Virginia as the hypocrite he is, lobbying for education funding from the Recovery Act he’s been lobbying against since last year. Point.
So the media momentum has shifted left a bit. But we can’t just sit back and be passive, can we? “We can’t let Republicans control the agenda and the message!” say paranoid political strategists on the left.
Well, maybe not completely. But lately they’ve done a good job digging themselves into a hole without your help, Democrats.
So, let ‘em talk.
The Tea Party is a joke. Every time Sarah Palin, Rush Limbaugh or Glenn Beck opens their mouth, people ridicule them across the political spectrum. Ron Paul? Not much of a threat when the Republican establishment still loathes him. Let them talk.
The “Party of No” is still just saying “no,” as evidenced by Bunning’s ignorant protest of the unemployment bill. If all the public hears is “no,” let ‘em talk.
Finally, the stimulus bill is working, the economy continues to improve and Obama is working hard to find solutions to our debt problem.
Meanwhile, Republicans continue to pan his economic proposals, as if they weren’t going home to hypocritically take credit for the stimulus. Let ‘em talk; it’s only hurting them. 
So Democrats, for now I think you should just ride the wave. Let the Republicans screw up their own messaging—you just focus on getting things done. The people will notice. You act, let them talk.
Alex Priest is a junior in the School of Communication and Kogod School of Business and a liberal columnist for The Eagle.
",0.05,0.079,0.871,0.11,0.305,0.586,0.102,0.083,0.815
2011-11-08,AU,conservative,"Just as one might wake up with a hangover after New Year’s, the government wakes up with a hangover at the beginning of a new fiscal year, said Heritage Foundation economic expert Alison Fraser.
Comparing the fiscal year to New Year’s Day, Fraser spoke about the current state of the economy at an AU College Republicans event Nov. 1
“Our hangover for the federal government is our debt,” she said. 
Fraser spoke to an audience of around 15 students in the University Club. Her organization, the Heritage Foundation, conducts conservative public policy research.
Fraser also discussed specific economic problems facing the United States and potential solutions to these problems.
“We are seeing a dramatic increase in the size and scope of our debt,” she said.  
America’s debt will only get worse with the direction the United States is headed in now, she said.  
“Our lesson learned, if any, from the EU’s experiences is that we are just a couple of years behind having to deal with the same issues,” she said.  
After explaining the issues, Fraser talked about solutions that the Heritage Foundation has supported in the past.  
“I would do it all on the spending side without raising taxes,” she said. “Rather than taxing the rich, I would rather take away their benefits,” referring to Social Security and Medicare.
Taxes make economic growth more difficult, she said.
“We’ve got to do this in a way that makes everyone’s future brighter,” Fraser said.
Fraser encouraged the students in attendance to talk to their parents and grandparents about these issues over Thanksgiving. 
She challenged students to ask them, “What are you going to do to help me?” 
“A lot of these solutions are going to rely on us having a conversation,” she said. 	
The solutions Fraser proposed seemed to resonate with many of the students at the event.  
“I really think she made a lot of sense,” said Ella Davis, a sophomore in the School of Public Affairs. “She had some really good ideas for the economy in the long term.”  
Charles Merrick, a sophomore in the College of Arts and Sciences, had a different opinion. 
“I generally liked the speech,” Merrick said. “I didn’t necessarily agree with things, but they made their points well.”  
Merrick said he was invited to the event by some of his Republican friends and attended because of his interest in economics.  
“It’s important to be open to other opinions,” he said.  
  rzisser@theeagleonline.com
",0.0,0.064,0.936,0.0,0.0,0.0,0.025,0.091,0.884
