date,school,keyword,article,article_neg,article_pos,article_neu,paragraph_neg,paragraph_pos,paragraph_neu,sentence_neg,sentence_pos,sentence_neu
2009-02-19,McGill,China,"Human Rights Watch director weighs in on the role of the international community in Rwandan and Sudanese genocides
International politics nullified domestic law in Sudan and Rwanda, sites of Africa’s most recent genocides, argued Georgette Gagnon, Executive Director of the Africa division of Human Rights Watch (HRW), at a lecture held by the McGill Centre for Human Rights and Legal Pluralism yesterday.
“In our experience, politics trumps law every time,” Gagnon said. “Our advocacy at Human Rights Watch is about taking that into account – not giving into it, but to address it and give our recommendations credibility.”
HRW is working in Africa to make politics accountable to law, thereby ensuring that human lives are not sacrificed in a larger political game. The organization performs strategic investigations to uncover human rights violations and hold oppressors accountable for their crimes.
Gagnon suggested that political forces were at work in the international community’s reluctance to label the mass killings of nearly one million Rwandans in 1994 as a genocide. She listed Rwanda’s lack of political muscle, oil, gold or other resources; the United States’s recent withdrawal from Somalia; and an overriding sense of racism of the western world as possible causes for international apathy.
A similar situation exists with the crisis in Sudan, according to Gagnon, who said United Nations Security Council members from China and Russia have perpetuated the crisis in Sudan because they have a political stake in the oil and arms business in the country, respectively.
Gagnon criticized the international community’s impulse to deploy troops to conflict zones when alternative, non-violent methods could be more effective. She suggested that radio jamming – disrupting the signals that in Rwanda were used to spread racial hate and to communicate violent commands to troops – could have been a practical and effective method of intervention. The Pentagon ruled against the tactic, claiming the cost – $8,000 an hour – was too expensive.
A law student voiced a concern commonly expressed in developing countries: that non-governmental organizations like HRW hand down universal principles, failing to account for unique political situations. HRW is currently criticized for urging the redress of current Rwandan ruler Paul Kagami, who they claim is keeping the region stable.  Kagami’s government killed 30,000 people in its early years after the genocide.
“We don’t interfere with political decisions. All we can say is, impartially, if he is committing war crimes then he should be brought to trial,” Gagnon replied.
Gagnon noted that HRW does work with grassroots organizations.
“In Africa there are vibrant local human rights communities that are pushing for the same things we are – universal human rights – and we always try to reach out and connect to those.”
She also acknowledged that politicians are forced to choose between peace and justice.
“The law should be applied impartially. Our job is advocacy and redress, but the more practical and realistic we are, the more likely [our policies will be effective],” Gagnon said. “Thus we should acknowledge our compromise. We say there is no durable peace without justice.”
A member of the audience noted that the work of human rights organizations is mainly reactive and reports violations, asking how groups work to prevent human rights abuse.
“Everything we do is preventive. It’s corruption, lack of access to resources, nepotism, social and economic violations of rights which lead to this kind of genocide,” Gagnon said.
 Economic and social legal violations are predictors of political abuse, she added, which is where HRW can help.
",0.134,0.0,0.866,0.09,0.043,0.867,0.159,0.095,0.746
2009-03-16,McGill,China,"Green Week speaker pushes for simple living
To hear audio from the walking tour of Chinatown, go to the multimedia blog at mcgilldaily.com
The pursuit of happiness should trump our desire for consumption, argued Professor Louis Chauvin during his Wednesday talk as part of McGill Green Week, hosted by the Science Undergraduate Society.
Chauvin, a management professor and President of Le Réseau Québécois pour la simplicité volontaire, an organization which promotes simplistic consumption, pointed directly to over-consumption as endangering our planet.
“For the past 14 years, I have asked myself why we are consciously destroying the carrying capacity of the Earth and what is needed for us to stop,” Chauvin told the audience.
Chauvin’s deep interest in consumption patterns and the environment inspired him to reach out to students, and teach them about responsible consumption and sustainability.
“I am a firm believer in education as a transformative process,” Chauvin said.
According to Chauvin, our society suffers from chronic dissatisfaction – a constant need for more – which harms the environment. He noted that many believe happiness is based on how much one consumes, which leads to over-consumption and depletes the world’s resources.
“People seek the high that comes with pleasure and are convinced that this sensation is the same as happiness,” explained Chauvin. “Whether it is gambling, excessive shopping, or a meaningless relationship, we give into these addictions and rely on such external factors for happiness.”
Chauvin added that usually as one consumes more and more, one requires a larger quantity of goods to maintain the excitement. He contrasted this attitude to pure happiness, which is rewarding for longer periods of time and leaves one with a feeling of fullness, without materialistic desires.
 “The pursuit of happiness is the ultimate goal for humans,” Chauvin said. “We want to be happy and we think certain commodities will make us happy or happier. The reality is, happiness comes from inside and is detached from consumption.”
During the question and answer period, one student asked whether the current economic crisis would act as a catalyst for responsible consumption.
“There is definitely an increased interest in voluntary simplicity,” answered Chauvin. “People are unable to get solutions from economists and politicians. Instead, they are looking for alternative ways to adjust their lifestyles.”
Later, one student asked whether or not a federal framework was needed for a real reduction in consumption.
“Even with federal frameworks, many societal issues, such as racism, are still present,” Chauvin said. “What we need to do is target individuals and promote personal transformations.”
Chauvin concluded with a message of hope and called for a change in lifestyle to save what is left of the planet.
“Our planet can only handle so much and so, simplicity is inevitable,” added Chauvin. “The question is, will it be voluntary or involuntary?”
",0.039,0.097,0.864,0.199,0.152,0.649,0.054,0.156,0.79
2009-03-16,McGill,China,"Campaign engages students with nearby neighbourhoods
To hear the whole Green Week talk by Professor Chauvin on consumption and the environment, go to the multimedia blog at mcgilldaily.com
McGill students got to know different parts of the Montreal community last week as part of the Office of Social Equity and Diversity Education (SEDE)’s “Burst Your Bubble 2009.”
Events included walking tours of Parc-Extension and Chinatown, as well as visits to Kanien’kehaka Onkwawén:na Raotitiohkwa Mohawk Language and Cultural Center in Khanawake and the Multi-Ethnic Association for the Integration of Persons with Disabilities (AMEIPH) just south of Little Italy.
“With this weather we can all get stuck in the ‘McGill bubble’: [the area bounded by] Sherbrooke, Pine, University, and Peel. It is so convenient to stay in that little square,” said Adama Kaba, SEDE’s Administrative Coordinator. “But as a university student you need concrete experiences. You can come here and get As, but if you want hands-on experience you need to get involved.”
This year’s campaign included events at Macdonald campus for the first time, and allowed McGill students to interact with Montreal’s least understood community groups. The trip to the South Shore was especially ambitious.
“People don’t go out to Khanawake,” said Kaba. “There is still a lot of prejudice attached to the First Nations people. But the visit to Khanawake was the first to be completely filled. By going out there and meeting with the organization, we hope students can learn more about the community and how they can be involved.”
SEDE is staffed by a young, diverse, and enthusiastic group that joined students on Thursday evening’s visit to the AMEIPH.
“We wanted people to learn more about the issue and about the specific challenges some disabled people are faced with,” said Kaba. “If you are an immigrant with a disability, and you don’t speak the language, how do you find the services that are available to you?”
Although Thursday’s visit showed low student turnout, Kaba insists that “Burst Your Bubble” is becoming increasingly popular.
“This year’s response has been even stronger and the numbers attending the visits have doubled. We have already received feedback about our walking tours and people really enjoyed them. We also receive feedback from community organizations that let us know when students become involved with them.”
Last year’s “Burst Your Bubble” campaign allowed McGill students to learn more about Montreal’s past with a visit to Écomusée du fier monde, a museum of industrial and working class history at the corner of Amherst and Ontario. Students also learned to appreciate Montreal’s diversity with visits to the Côte-des-Neiges Black Community Association and Kapit Bisig Filipino Community Centre.
Food appears to be a key incentive in drawing support from students, with community organizations preparing a few dishes for each visit. Students visiting the AMEIPH discussed the organization’s objectives over an elaborate, multi-ethnic meal.
As well, the cafeterias in Bishop Hall, Douglas Hall, and RVC served “finger food from different countries” on March 5.
SEDE will wrap up the multi-week campaign with a “Community Connections” dinner and film screening in partnership with Radio Canada International on March 18, although the RSVP deadline has passed.
",0.0,0.034,0.966,0.026,0.054,0.92,0.016,0.079,0.905
2009-03-23,McGill,China,"North America’s smallest dinosaur uncovered
EDMONTON – It was an adventure that began back in 1982, but 27 years later, Philip Currie, a paleontologist and biological sciences professor at the University of Alberta (UofA), is able to confirm that he and his colleague have identified the smallest dinosaur known to have roamed North America.
The discovery and identification of the carnivorous Hesperonychus elizabethae – a species so small it would fit in the palm of one’s hand – will be published in Proceedings of the National Academy of Sciences this month.
Originally thought to be a bone fragment from a lizard, the piece was found by a University of Calgary student hired by the UofA to work in Alberta’s Dinosaur Provincial Park.
“She was looking mostly for smaller animals, and the small fossils she found, she thought probably belonged to a lizard,” said Currie, explaining that it wasn’t until the late nineties, when a feathered skeleton named Microraptor was uncovered in China, that a connection was made.
“He realized that [the bone] is almost identical to the one in China in terms of hip structure,” Currie said.
Despite missing a complete skeleton, the ability to compare their fragment to the specimen in China allowed for a concise comparison of each structure.
While paleontologists have discovered many skeletons in Alberta over the years, Currie explained that many of the smaller specimens remain incomplete, which limited the field of study.
“[Big skeletons] only give you one side of the story. [They] preserve a lot more easily than small things because you don’t have things eating them, you don’t have slivers that are ripping the pieces apart.”
Currie’s discovery proves that there is still a lot to be learned.
“We want to know what’s going on with the other side of the ecosystem; all the small animals and that includes not just dinosaurs, but all the things living with the dinosaurs.” he said.
For Currie, Hesperonychus elizabethae is the first of many skeletons that will eventually reach the surface.
“I’m willing to bet that in a couple years, we’re going to have more small dinosaur species than big dinosaurs species.”
– Kirsten Goruk, (CUP Alberta and Northern Bureau Chief)
SFU to privatize residences
BURNABY – B.C.’s Simon Fraser University (SFU) is looking to contract a private company to fund, manage, and maintain on-campus student residences.
Citing a lack of capital available for major repairs to residence buildings and a desire to increase capacity, the university wants to avoid taking a loan out to complete these projects.
“We’re just looking for creative ways to try and deal with residences, “said Pat Hibbits, SFU’s VP Finance.
Currently, SFU on-campus residences house about nine per cent of students, a figure SFU hopes to see hit 15 per cent while doubling on-campus housing space over the next five years.
Thompson Rivers University (TRU) in Kamloops, B.C., and the University of Ottawa already have privatized residences.
“Universities are turning the housing around to the private sector due to the fact that the price to operate is definitely high,” said Mark Woloski, TRU’s residence manager.
“We can control the prices we offer the students because we’re not paying a hefty wage to all our staff, so that’s probably why a lot of universities are changing to private sectors – because the cost of operations are skyrocketing, being a union-run facility.”
In terms of cost to students, Woloski claimed it is “virtually the same” as off-campus housing.
“We follow everyone else’s lead. We keep in regular communication with all the other on-campus housing units throughout B.C., and we don’t like pricing ourselves out of the market or wanting to gouge,” he said.
Nichole DeMichelis, a second-year political science student living in the McTaggart-Cowan residence, was optimistic about what privatization could bring to the residences.
“SFU is lacking a lot of funding, and one of the big priorities is to build more residences to secure that sense of community,” DeMichelis said. “I would be all for having new buildings with proper kitchens. I think it sounds like a great idea.”
– David Dyck, The Peak (CUP)
Student finds tuition in her Tim’s cup
TORONTO – At best, Khalin Elliott was hoping for a free snack when she checked under the rim of her Tim Horton’s coffee cup last Wednesday. But instead of a free pastry, the first-year media student found a tiny dollar sign followed by a big number under the rim of her medium hot chocolate – $10,000, courtesy of the Tim Hortons Roll Up The Rim contest.
The oldest of four girls, Elliot has relied on government funding and a competitive entrance scholarship to cover her tuition and residence fees this year.
“There’s six of us [in my family] so we go through struggles and stuff like that. We’re kind of in the middle in a way, like most big families are, so getting this is definitely going to help with school,” Elliott said.
She plans to spend her money on a new computer because her current MacBook runs slowly, and she wants something to handle advanced graphics work.
“Everything’s computer-based in our classes,” she explained.
The leftover cash will pay her tuition for second year.
Elliott recalled her surprise when she uncovered her prize.
“I had to get them to read it over to make sure I wasn’t going crazy,” she said, claiming that she never wins anything.
Elliott explained that she and her friends always take a break during their three-hour visual studies class, usually opting for a quick trip to the nearby Tim Hortons. All three of them ordered hot chocolate.
Her two friends said they were thrilled she won – even though they could have won if they had lined up in a different order.
According to Lucy Rocque, the employee at Tim Horton’s who handed Elliot the winning cup, more customers have been getting their coffee fix at her Tim’s since the $10,000 win, hoping to get lucky. Last Friday, someone stopped by to tell them they had won a $100 Tim Card from that location.
– Aleysha Haniff, The Eyeopener (CUP)
Alberta college launches free nursing program
EDMONTON – Bow Valley College, an Albertan institution focusing on English as a second language (ESL) training, is introducing a free 20-month pilot program designed to help immigrants with a nursing degree upgrade their skills and find employment in Canada.
“It’s designed to take people who have nursing from their own country and give them the language and Canadian health cultural knowledge that they need to be able to practice in the Canadian health system,” said Isabel Gibbins, Dean of ESL and Languages at the college, explaining that many candidates’ English levels proved to be a barrier during the qualifying exam.
The program was first introduced at NorQuest College in Edmonton, but once the provincial government was aware of its success, they introduced it to other institutions. It resembles the usual training for nurses, though it is shorter because many of the nurses already have background knowledge.
Gibbins said the program intends to create a link between those who have ventured to Canada in search of employment, and the Canadian services that are seeking that very expertise.
“We really feel that there are a lot of people who have skills from their country that they aren’t able to use in Canada,” she said. “One of the things that’s important to us is to be able to work on providing some of those transition courses.”
Initial funding for the Bow College program will come from Alberta Employment and Immigration, but once the pilot period ends, Gibbins hopes to sustain it through enrolment fees. They intend to advertise it at current ESL classes, health-care facilities, and the college’s open house.
– K.G.
Undergrad-made iPhone app aimed at students
FREDERICTON – While many students are wondering what they’re going to do with their degrees after they get out of school, third-year computer science student Jason Brennan has already put his education to good use.
Brennan, a 20-year-old student at the University of New Brunswick, designed an application called Keener for the Apple iPhone to help students keep track of their grades and organize their school work.
“You put in your courses when you start the semester,” said Brennan. “You put in your homework assignments, your quizzes, and the labs that are coming up. You put in the due dates, and it gives you a list of what’s due, what’s overdue, and what’s due next week. And when you get your tests and assignments back you just punch in your marks and it keeps track of your overall grades for the semester.”
Keener can also calculate weighted grades as classes progress.
Brennan, who owns an iPhone, developed Keener between November and January, and cited his own university experience as his inspiration.
“I came up with this because I am not a keener at all,” laughed Brennan. “I’m not very studious and I find that I’m a lot more organized if I have a way to record everything.”
Brennan found traditional agendas problematic, but wanted an organizer that he could keep with him at all times. Developing Keener allowed him to resolve this problem, and learn more about computer programming, one of his interests outside of school.
Keener went on sale January 25 for $4.99. Brennan gets 70 per cent, or $3.50, from each sale. The other 30 per cent goes to Apple and the company handles all the billing and shipping.
– Cameron Mitchell, The Brunswickan (CUP)
",0.0,0.06,0.94,0.016,0.071,0.914,0.018,0.126,0.856
