date,school,keyword,article,article_neg,article_pos,article_neu,paragraph_neg,paragraph_pos,paragraph_neu,sentence_neg,sentence_pos,sentence_neu
2009-03-23,McGill,China,"North America’s smallest dinosaur uncovered
EDMONTON – It was an adventure that began back in 1982, but 27 years later, Philip Currie, a paleontologist and biological sciences professor at the University of Alberta (UofA), is able to confirm that he and his colleague have identified the smallest dinosaur known to have roamed North America.
The discovery and identification of the carnivorous Hesperonychus elizabethae – a species so small it would fit in the palm of one’s hand – will be published in Proceedings of the National Academy of Sciences this month.
Originally thought to be a bone fragment from a lizard, the piece was found by a University of Calgary student hired by the UofA to work in Alberta’s Dinosaur Provincial Park.
“She was looking mostly for smaller animals, and the small fossils she found, she thought probably belonged to a lizard,” said Currie, explaining that it wasn’t until the late nineties, when a feathered skeleton named Microraptor was uncovered in China, that a connection was made.
“He realized that [the bone] is almost identical to the one in China in terms of hip structure,” Currie said.
Despite missing a complete skeleton, the ability to compare their fragment to the specimen in China allowed for a concise comparison of each structure.
While paleontologists have discovered many skeletons in Alberta over the years, Currie explained that many of the smaller specimens remain incomplete, which limited the field of study.
“[Big skeletons] only give you one side of the story. [They] preserve a lot more easily than small things because you don’t have things eating them, you don’t have slivers that are ripping the pieces apart.”
Currie’s discovery proves that there is still a lot to be learned.
“We want to know what’s going on with the other side of the ecosystem; all the small animals and that includes not just dinosaurs, but all the things living with the dinosaurs.” he said.
For Currie, Hesperonychus elizabethae is the first of many skeletons that will eventually reach the surface.
“I’m willing to bet that in a couple years, we’re going to have more small dinosaur species than big dinosaurs species.”
– Kirsten Goruk, (CUP Alberta and Northern Bureau Chief)
SFU to privatize residences
BURNABY – B.C.’s Simon Fraser University (SFU) is looking to contract a private company to fund, manage, and maintain on-campus student residences.
Citing a lack of capital available for major repairs to residence buildings and a desire to increase capacity, the university wants to avoid taking a loan out to complete these projects.
“We’re just looking for creative ways to try and deal with residences, “said Pat Hibbits, SFU’s VP Finance.
Currently, SFU on-campus residences house about nine per cent of students, a figure SFU hopes to see hit 15 per cent while doubling on-campus housing space over the next five years.
Thompson Rivers University (TRU) in Kamloops, B.C., and the University of Ottawa already have privatized residences.
“Universities are turning the housing around to the private sector due to the fact that the price to operate is definitely high,” said Mark Woloski, TRU’s residence manager.
“We can control the prices we offer the students because we’re not paying a hefty wage to all our staff, so that’s probably why a lot of universities are changing to private sectors – because the cost of operations are skyrocketing, being a union-run facility.”
In terms of cost to students, Woloski claimed it is “virtually the same” as off-campus housing.
“We follow everyone else’s lead. We keep in regular communication with all the other on-campus housing units throughout B.C., and we don’t like pricing ourselves out of the market or wanting to gouge,” he said.
Nichole DeMichelis, a second-year political science student living in the McTaggart-Cowan residence, was optimistic about what privatization could bring to the residences.
“SFU is lacking a lot of funding, and one of the big priorities is to build more residences to secure that sense of community,” DeMichelis said. “I would be all for having new buildings with proper kitchens. I think it sounds like a great idea.”
– David Dyck, The Peak (CUP)
Student finds tuition in her Tim’s cup
TORONTO – At best, Khalin Elliott was hoping for a free snack when she checked under the rim of her Tim Horton’s coffee cup last Wednesday. But instead of a free pastry, the first-year media student found a tiny dollar sign followed by a big number under the rim of her medium hot chocolate – $10,000, courtesy of the Tim Hortons Roll Up The Rim contest.
The oldest of four girls, Elliot has relied on government funding and a competitive entrance scholarship to cover her tuition and residence fees this year.
“There’s six of us [in my family] so we go through struggles and stuff like that. We’re kind of in the middle in a way, like most big families are, so getting this is definitely going to help with school,” Elliott said.
She plans to spend her money on a new computer because her current MacBook runs slowly, and she wants something to handle advanced graphics work.
“Everything’s computer-based in our classes,” she explained.
The leftover cash will pay her tuition for second year.
Elliott recalled her surprise when she uncovered her prize.
“I had to get them to read it over to make sure I wasn’t going crazy,” she said, claiming that she never wins anything.
Elliott explained that she and her friends always take a break during their three-hour visual studies class, usually opting for a quick trip to the nearby Tim Hortons. All three of them ordered hot chocolate.
Her two friends said they were thrilled she won – even though they could have won if they had lined up in a different order.
According to Lucy Rocque, the employee at Tim Horton’s who handed Elliot the winning cup, more customers have been getting their coffee fix at her Tim’s since the $10,000 win, hoping to get lucky. Last Friday, someone stopped by to tell them they had won a $100 Tim Card from that location.
– Aleysha Haniff, The Eyeopener (CUP)
Alberta college launches free nursing program
EDMONTON – Bow Valley College, an Albertan institution focusing on English as a second language (ESL) training, is introducing a free 20-month pilot program designed to help immigrants with a nursing degree upgrade their skills and find employment in Canada.
“It’s designed to take people who have nursing from their own country and give them the language and Canadian health cultural knowledge that they need to be able to practice in the Canadian health system,” said Isabel Gibbins, Dean of ESL and Languages at the college, explaining that many candidates’ English levels proved to be a barrier during the qualifying exam.
The program was first introduced at NorQuest College in Edmonton, but once the provincial government was aware of its success, they introduced it to other institutions. It resembles the usual training for nurses, though it is shorter because many of the nurses already have background knowledge.
Gibbins said the program intends to create a link between those who have ventured to Canada in search of employment, and the Canadian services that are seeking that very expertise.
“We really feel that there are a lot of people who have skills from their country that they aren’t able to use in Canada,” she said. “One of the things that’s important to us is to be able to work on providing some of those transition courses.”
Initial funding for the Bow College program will come from Alberta Employment and Immigration, but once the pilot period ends, Gibbins hopes to sustain it through enrolment fees. They intend to advertise it at current ESL classes, health-care facilities, and the college’s open house.
– K.G.
Undergrad-made iPhone app aimed at students
FREDERICTON – While many students are wondering what they’re going to do with their degrees after they get out of school, third-year computer science student Jason Brennan has already put his education to good use.
Brennan, a 20-year-old student at the University of New Brunswick, designed an application called Keener for the Apple iPhone to help students keep track of their grades and organize their school work.
“You put in your courses when you start the semester,” said Brennan. “You put in your homework assignments, your quizzes, and the labs that are coming up. You put in the due dates, and it gives you a list of what’s due, what’s overdue, and what’s due next week. And when you get your tests and assignments back you just punch in your marks and it keeps track of your overall grades for the semester.”
Keener can also calculate weighted grades as classes progress.
Brennan, who owns an iPhone, developed Keener between November and January, and cited his own university experience as his inspiration.
“I came up with this because I am not a keener at all,” laughed Brennan. “I’m not very studious and I find that I’m a lot more organized if I have a way to record everything.”
Brennan found traditional agendas problematic, but wanted an organizer that he could keep with him at all times. Developing Keener allowed him to resolve this problem, and learn more about computer programming, one of his interests outside of school.
Keener went on sale January 25 for $4.99. Brennan gets 70 per cent, or $3.50, from each sale. The other 30 per cent goes to Apple and the company handles all the billing and shipping.
– Cameron Mitchell, The Brunswickan (CUP)
",0.0,0.06,0.94,0.016,0.071,0.914,0.018,0.126,0.856
2009-03-26,McGill,China,"McGill launched the Institute for the Study of International Development (ISID) on Monday with an inaugural conference focusing on the future of development.  ISID will absorb the existing Centre for Developing Areas Studies (CDAS) into its broader mandate to renew energy for development in a changing global context.
 Like CDAS, ISID will continue to be committed to multidisciplinary research, but with renewed emphasis on accountability and evidenced-based policy-making. It will eventually become home to undergraduate programs in International Development Studies, African Studies, Middle Eastern Studies and Latin American and Caribbean Studies, as well as a new Development Studies option at the Master’s level.
Phillip Oxhorn, the ISID Director, stressed that the energy of youth interested in development figures centrally in the new institute.
“ISID brings under one roof what universities can uniquely do while also capturing the energy and commitment of young people,” he said, explaining that the institute is a response to changes in the global order.
 Among those present was David Malone, President of the International Development Research Centre welcomed the launch of the institute by emphasizing the importance of their goal.
“Development is a dead serious business and should be treated with the seriousness it deserves,” he said, adding that it would be important for the ISID to break from Canadian precedent by sharing its success stories and disseminating its work more widely.
 The evening’s visiting keynote from India, Dr. Pratap Bhanu Mehta, President of the Centre for Policy Research in New Delhi, pointed to the timeliness of the ISID given the rise of China and India.
“It will not be a shift without conflict,” he said. “Both have a sense of growth and entitlement, they are not negligible.”
Mehta expressed hope that development policy-makers and practitioners to be more critical of the various assumptions held within the field, and called on the development community to be more aware of state actions.
“The most representative and participatory states are not necessarily the most responsive,” he said.
 Other attendees at the Institute launch include McGill President Heather Munro-Blum, McGill Dean of Arts Christopher Manfredi, Canadian International Development Agency President Margaret Briggs, and International Development Research Centre President David Malone, the Right Honourable Joe Clark.
Roughly seventy people – mostly academics and practitioners – were present for the opening ceremonies at the Omni Hotel, with more joining in on Tuesday panels offering perspectives from donor agencies, non-state actors in development, various development institutions, and from youth practitioners, lasting throughout the day.
In his keynote address, Save the Children CEO David Morley acknowledged the privilege of speaking about poverty while conference delegates enjoyed a decadent three-course catered lunch.
Adam Matheson, U3 International Development studies commented on the elegance of the lunch.
“I understand the need to have a professional, formal conference to attract important speakers and guests; but a lavish 3 course meal while we listened to statistics on world hunger and squandered aid money seemed a little ironic.”
",0.0,0.0,1.0,0.093,0.0,0.907,0.041,0.132,0.827
2009-10-05,McGill,China,"Chinese immigrant workers awarded $164,000 in damages
The Quebec Human Rights Commission ruled this September that 15 Chinese workers should receive $164,000 in damages from their employer, Calego International, for racial discrimination in the workplace. It is the heaviest fine to be levied by the Commission in a human rights case to date.
The Commission asked that $10,000 be paid in moral and punitive damages to each worker and $5,000 paid to two workers who were forcibly thrown off the company’s premises in plain view of co-workers.
The incident took place in July 2006, when a group of 40 employees were called into a meeting with Calego International’s president, Stephen Rapps. The workers testified to the Commission that Rapps yelled at them, saying, “You Chinese eat like pigs!”
He Yong Han, a former employee and Chinese immigrant now residing in Montreal, reported to The Daily that Rapps told the workers to wash themselves daily, and that they were no longer in China.
He said that Rapps chastised the workers for unsanitary work conditions, warning them not to get urine on the floor when using the toilet.
Of all the employees at Calego International, the Chinese workers were the only ones who were called to the meeting.
He reported further that workers walked out immediately after, returning the next day to demand a written apology from Rapps, a cleaner work environment (workers say that at the time, there were no janitorial staff working), and compensation for what they saw as discriminatory actions. The demands were turned down, leading many of the workers to quit their jobs.
The workers then filed a complaint through the Center for Research-Action on Race Relations (CRARR).
Calego International is a Montreal-based children’s backpack and accessories manufacturer. Rapps, a supervisor, and Agence Vincent, the placement agency through which the Chinese workers were hired, will share the payment of damages.
Julius Grey, the lawyer who represents Calego International, has denied that the incident took place.
Despite the fact that the fine is the largest sum that the Quebec Human Rights Commission has recommended in a racism case, Fo Niemi of CRARR, who helped these workers file their complaint, stated that the amount is less significant when the amount of damages awarded to each individual worker is considered.
“This may be why discrimination still goes on, because if we had the kind of damages awarded as in the United States, where we’re talking about hundreds of thousands of dollars, many people would think twice before committing racial discrimination,” Niemi said.
The former Calego employees have received support from the Montreal Chinese community, in the form of encouragement, assistance, and monetary aid. The Montreal Chinese Cultural Centre helped the workers find lawyers and gather information for their case.
Niemi notes that very few complaints are filed from people of Asian backgrounds, although Asian workers are a large number of the immigrant workers who are often forced to work in substandard conditions.
",0.0,0.13,0.87,0.099,0.13,0.772,0.094,0.066,0.84
2009-10-08,McGill,China,"Nobel Peace Prize winner emphasizes the importance of compassion
This Saturday, His Holiness the 14th Dalai Lama made two presentations in Montreal, one to a 500-person invite-only event hosted by McGill’s Faculty of Education, and a second to a crowd of 14,000 people at the Bell Centre.
The 74-year-old Nobel Peace Prize winner felt compelled to request a private audience with education students after he learned of the provincial government’s introduction of a controversial ethics and religious culture class to primary and secondary students throughout Quebec.
During both addresses, the Dalai Lama emphasized the need for a balance between intellectualized faith and secular ethics.
“His Holiness was interested in speaking with students involved to support the notion that human values, ethical issues, and respect for religious and secular traditions is a positive initiative,” said education professor Spencer Boudreau, McGill’s ombudsperson and the main organizer of the event. “[Religion] is part of our culture and history; it’s a powerful force in the world [that] we’ve neglected,” Boudreau said.
Due to the limited tickets available for the McGill talk, the McGill organizing committee decided to stream the two-hour event on learnquebec.org, where it is still available to site users.
During the McGill address, the Dalai Lama stressed to education students that instilling a positive religious tolerance in youth was critical for a compassionate society.
“Please carry your profession with sincere motivation and a sense of global responsibility,” the Dalai Lama said. “At least, with some aim or goal [that] out of this century, a more compassionate world [will come].”
Mitchell Miller, the president of the Education Undergraduate Society, had the opportunity to sit with the Dalai Lama. Miller was selected to thank His Holiness on behalf of the anglophone universities in Quebec.
“Sometimes it feels like there is a lot of unnecessary self-deprecation among students in this faculty. [The Dalai Lama’s visit] was a reaffirmation for us as educators of the power that we can have,” Miller said.
Heather Monroe-Blum served as the master of ceremonies.
Later that day, during his presentation at the Bell Centre, His Holiness asserted that he had no political or spiritual agenda. Instead, he hoped to articulate the need of shared links between humanity, to be compassionate, and work to make the world a better place.
“I am talking as a human being to another human being. Not as a monk, Buddhist, or Tibetan,” he said.
Nonetheless, the event took on a political tone as Chinese and Uyghur protesters assembled outside. Tibet has been administered and controlled by the People’s Republic of China since it occupied the territory in 1950. The Dalai Lama, recognized as the exiled political leader of Tibet, fled the territory in 1959 and is seen as a threat to the national identity and integrity of China.
“It’s our country. We love it,”one Chinese protester said, standing calmly with several others in objection to the Dalai Lama’s visit to Montreal. A couple of Tibetans yelled at them to leave Canada and go back to China.
Uyghurs, a Muslim ethnic minority from Western China, also demonstrated in solidarity with the Tibetans. They called on China to recognize their human rights, stating that they were “the other Tibetans.”
",0.104,0.121,0.775,0.141,0.049,0.81,0.029,0.173,0.798
2009-10-08,McGill,China,"Nobel Peace Prize winner emphasizes the importance of compassion
This Saturday, His Holiness the 14th Dalai Lama made two presentations in Montreal, one to a 500-person invite-only event hosted by McGill’s Faculty of Education, and a second to a crowd of 14,000 people at the Bell Centre.
The 74-year-old Nobel Peace Prize winner felt compelled to request a private audience with education students after he learned of the provincial government’s introduction of a controversial ethics and religious culture class to primary and secondary students throughout Quebec.
During both addresses, the Dalai Lama emphasized the need for a balance between intellectualized faith and secular ethics.
“His Holiness was interested in speaking with students involved to support the notion that human values, ethical issues, and respect for religious and secular traditions is a positive initiative,” said education professor Spencer Boudreau, McGill’s ombudsperson and the main organizer of the event. “[Religion] is part of our culture and history; it’s a powerful force in the world [that] we’ve neglected,” Boudreau said.
Due to the limited tickets available for the McGill talk, the McGill organizing committee decided to stream the two-hour event on learnquebec.org, where it is still available to site users.
During the McGill address, the Dalai Lama stressed to education students that instilling a positive religious tolerance in youth was critical for a compassionate society.
“Please carry your profession with sincere motivation and a sense of global responsibility,” the Dalai Lama said. “At least, with some aim or goal [that] out of this century, a more compassionate world [will come].”
Mitchell Miller, the president of the Education Undergraduate Society, had the opportunity to sit with the Dalai Lama. Miller was selected to thank His Holiness on behalf of the anglophone universities in Quebec.
“Sometimes it feels like there is a lot of unnecessary self-deprecation among students in this faculty. [The Dalai Lama’s visit] was a reaffirmation for us as educators of the power that we can have,” Miller said.
Heather Monroe-Blum served as the master of ceremonies.
Later that day, during his presentation at the Bell Centre, His Holiness asserted that he had no political or spiritual agenda. Instead, he hoped to articulate the need of shared links between humanity, to be compassionate, and work to make the world a better place.
“I am talking as a human being to another human being. Not as a monk, Buddhist, or Tibetan,” he said.
Nonetheless, the event took on a political tone as Chinese and Uyghur protesters assembled outside. Tibet has been administered and controlled by the People’s Republic of China since it occupied the territory in 1950. The Dalai Lama, recognized as the exiled political leader of Tibet, fled the territory in 1959 and is seen as a threat to the national identity and integrity of China.
“It’s our country. We love it,”one Chinese protester said, standing calmly with several others in objection to the Dalai Lama’s visit to Montreal. A couple of Tibetans yelled at them to leave Canada and go back to China.
Uyghurs, a Muslim ethnic minority from Western China, also demonstrated in solidarity with the Tibetans. They called on China to recognize their human rights, stating that they were “the other Tibetans.”
",0.104,0.121,0.775,0.141,0.049,0.81,0.029,0.173,0.798
