,school,date,txt_file,matching_text,matching_links,positive,negative,neutral
1407,UCF,2014-09-30,journal_data/txt/UCF/2014_09_30.txt,"['Women’s Soccer\nThe nationally ranked UCF women’s soccer team brought home two wins this past weekend, bumping the Knights up to the No. 23 seed, and leaving them to become the 18th team ever in NCAA Division I history to win at least 22 consecutive conference games (including conference tournaments).\nAn early goal made by senior forward Tatiana Coleman gave the Knights (9-2-0, 2-0-0 ACC) the lead they needed in their first conference game of the year. The forward’s seventh goal of season was enough to hold off the Tigers (4-5-2, 1-1-0 ACC) for the first half of the game until Memphis’ Valerie Sanderson broke through in the 68th minute for the equalizer, closing UCF’s four game shutout streak.\nAs an overtime situation approached, Tatiana Coleman connected a ball in the 85th minute but would be denied the goal for the win. Undeterred, Coleman saw another opportunity with less than two minutes to go, shooting the ball in Memphis territory and leaving Tiger’s goalkeeper Valerie Sanderson to deflect the ball into her own net, giving the Knights the win.\n“I thought we started off strong scoring a goal really early, we played really well and caught them off guard and put one away early so that was great,” said head coach Tiffany Roberts Sahaydak after the match. “Memphis had us on our heels the majority of the game… We were able to overcome a lot of challenges tonight so I’m really proud of the team.”\nIn the game that placed UCF’s 2014 women’s soccer team in both UCF and NCAA record books, the Knights left Oklahoma with a 4-1 win over Tulsa (7-4-1, 1-1-0 ACC).\nA mere three minutes into the game, senior Ashley Spivey put her team ahead by slipping a shot past Tulsa goalkeeper Courtney McKeon. Met with pressure, Tulsa’s Christina Holmes responded with the equalizer in the 31st minute, but only two minutes later would midfielder Jennifer Martin reclaim the lead for the Knights.\n“As the game went on we did gain more confidence… It’s great having a deep team where we can rely on everybody,” said head coach Tiffany Roberts Sahaydak. “Great performance overall, we are happy with the result and we did grow as the game went on.”\nTwo more goals would be gained by UCF before the game’s end, both made by senior Kayla Darden.\n“It wasn’t our best effort by any means, but we knew UCF was going to be a tough team and that they are ranked for a reason,” Tulsa head coach Kyle Cussen said. “They pressed very hard from the start.”\nA sixth consecutive win for UCF would help senior Carleigh Williams earn Defensive Player of the Week, her first accolade of the season, and the team’s seventh. The women’s team also leads the league in goals allowed (.64), goals against average (.63) and shutouts, according to UCFKnights.com.\nThe next conference game will be at home against SMU at 7:00pm on Friday, followed by Houston at home at 1:00pm, Sunday.\nMen’s soccer\nDespite a 2-4 loss to Indiana last Wednesday, the men’s soccer team fought to put up the two goals made against the No. 17 team.\n“I was really proud of our player’s effort tonight,” said head coach Bryan Cunningham in a post-game interview. “Of course, we don’t like giving up four goals in a match, but there were times where we controlled the tempo of the game and created chances that were very dangerous.”\nThe Knights (1-5-2, 0-0-1 ACC) nearly had their second goal of the night in the 14th minute when a shot from Romario Williams was made at close range, but stopped by Colin Webb, Indiana’s goalkeeper.\nRomario would soon cut down Indiana’s two point lead with a goal early in the second half, adding on to a goal made by Jake Weiss in the first half.\nUCF and the Hoosiers (5-1-3, 1-1-1 ACC) would finish with 12 shots a piece, with UCF making a match high eight corner kicks.\nThe Knights tied Memphis (4-2-2, 0-0-1 ACC) in a match played on Saturday, with both teams scoreless in the first half and both teams putting one on the scoreboard in the second.\n“I thought that we executed our game plan,” head coach Bryan Cunningham said in a post-game interview. “We controlled the match for 110 minutes, we held possession, and were dangerous. We had a good, positive, momentum even though we had a tough result at Indiana the other night. Our work rate was very good and our attitude was very good. I thought tonight we came out and we took a step forward in terms of how we want to play as a team. We did a lot of things right and we are on the right path.”\nBoth teams had chances in overtime to win but were unable to capitalize due to pressure made on both sides, trading opportunities until time ran out, and leaving the score tied.\nThe men’s soccer team will progress, and face Memphis again on October 11th at Memphis.\nOn Saturday the Knights will host SMU at 7:00pm ET in the conference match.']",['https://knightnews.com/2014/09/ucf-womens-soccer-team-brings-one-home-for-the-record-books/'],0.4999620020389557,0.3576309084892273,0.28481972217559814
1425,UCF,2014-10-23,journal_data/txt/UCF/2014_10_23.txt,"['Sangam’s 2014 Diwali Show attracted 450 students to the UCF Pegasus Ballroom on Sunday evening.\nSangam, the Indian Student Association at UCF, hosted the yearly event in celebration of the upcoming holiday, Diwali (The Festival of Lights). The organization expected 230 to 275 students to attend the event, but was surprised with a much larger turnout, according to Snigdha Ila, Sangam’s volunteer director.\n“I believe this is the biggest Diwali Show success in Sangam’s history,” said Sangam’s President Shivan Vyas.\nThe event was held for a total of five hours, included various performances and a traditional Indian dinner. Entry to this event was free for UCF students.\nAccording to Vyas, there were performers from all across the university reflecting the various cultures found within India.\n“We had eight performances during the event and more than 50 people performing within these performances. We had classical dances such as Garva Raas, modern Bollywood, fusion dances with a mixture of classical and modern, along with dances in peoples’ specific sublanguages such as Punjabi or Telugu,” said Vyas.\nSangam held two days of auditions prior to the event. They also made auditions available to students online as well. Performers were given the opportunity to send in a short clip of their performance, according to Ila.\nAfter the show a full course Indian meal was provided by Aashirwaad, a local Indian restaurant. According to Vyas, the crowds favorite dishes were Paneer Masala, which is a curry based dish, and Naan. Other traditional dishes included Samosa, Malai Fogta and Daal.\nKhusbu Patel, Sangam’s Events Director, helped arrange the decorations for the event. According to Vyas, their goal was to create a simple but yet elegant reflection of Diwali by using vibrant colors.\n“The decorations on stage used brightly colored fabric to decorate the backdrop with a Sangam banner in the center of the stage,” Ila said.\nOverall Ila thought this year’s event was a huge success.\n“It was an amazing turnout from the UCF and Indian community, and it was great to see everyone celebrate the culture and festival together.”']",['https://knightnews.com/2014/10/sangams-2014-diwali-show-has-best-turnout-yet/'],0.9856363534927368,0.013125444762408733,0.32716137170791626
1451,UCF,2014-11-25,journal_data/txt/UCF/2014_11_25.txt,"['After what appeared to be a strong start for the Tampa Bay Buccaneers, Miami Dolphins, and Jacksonville Jaguars, all three teams found a way to let a win slip out of their hands this past week. \nIt may not be surprising for the Jaguars or Buccaneers anymore, but it’s disappointing for the Dolphins, considering how much potential they have shown this season.\nThe Buccaneers showed a lot of promise in the first two quarters of Sunday’s game, heading into the half with a 10-0 lead over the Chicago Bears, but problems were already clearly present. Once each team reappeared on the field, these problems only appeared more exaggerated. \nAfter a stellar performance from Josh McCown last week, the Buccaneer’s veteran quarterback managed to do little more than sabotage any of their hopes for victory. Throwing two interceptions and managing to gain little momentum from their three scoring drives, McCown’s performance really called into question Lovie Smith’s offensive strategy, once again. The game ended, with a Bear’s triumph of 21-13. Next week, the Buccaneers host the Cincinnati Bengals for a 1:00 P.M. game.\nTurning attention to the one Florida team with playoff hopes, the Miami Dolphins faced the Denver Broncos, in what became a nail-biter of a game, ending with the Bronco’s victory of 36-39. After three quarters of Dolphins domination, their defense seemed to give up altogether, allowing their opponent to score 22 points in the final quarter. While they may remain second in their division, even with this loss, their chances of making it to the playoffs are becoming slimmer and slimmer. They play the New York Jets, next Monday, at 8:30 P.M.\nFinally, we have to discuss one of the only teams worse than the Buccaneers, the Jacksonville Jaguars, who have again demonstrated their inability to do anything on either side of the ball, with a 23-3 loss to the Indianapolis Colts. The Colts prevented anything more than a single field goal from being scored against them, as well as intercepting the ball once and recovering a fumble. Blake Bortles has been struggling this season to live up the life of his college career, and his performance this past week was one of his most abysmal, ending the game with a passer rating of 55.5. Hopefully next week he can manage to get something going, as the team hosts the New York Giants for a 1:00 P.M. game.']",['https://knightnews.com/2014/11/promising-starts-lead-to-disappointment-for-buccaneers-dolphins-and-jaguars/'],0.061185404658317566,0.21405813097953796,0.04586232453584671
1485,UCF,2015-01-13,journal_data/txt/UCF/2015_01_13.txt,"['In a post-season filled with questionable rulings, narrow victories and underdog comebacks, we now have only the conference championships to look forward to before Super Bowl Sunday is upon us once more. \nThis weekend featured two of the closest games of the season along with a surprise upset, as the Indianapolis Colts prevented the Denver Broncos from another Super Bowl appearance, and a last minute slaughter when the Seattle Seahawks put the Carolina Panthers back in their place.\nThe weekend began with the Baltimore Ravens heading to Foxboro to face the New England Patriots in a game that was decided by an interception thrown by Joe Flacco in the last two minutes of the game, cinching the Patriots’ advancement, with a final score of 31-35.\nThe second game of the night featured a team no one expected to make it past the first round, the Carolina Panthers, who took on last year’s Super Bowl champions, the Seattle Seahawks. Considering the fact that the Panthers were unable to even break the .500 barrier during the regular season, it was a shock to see them attain any success in the post-season. Unfortunately, it was impossible for them to keep that momentum going, as the Seahawks managed to dominate in the final, for a game ending score of 31-17.\nSunday began with a game that made up for last week’s highly questionable calls. \nWhen the Dallas Cowboys defeated the Detroit Lions in the first round of the playoffs, many cried foul over some of the referees’ rulings. Well after the Cowboys loss to the Green Bay Packers, it seems balance has been restored to the universe. Green Bay’s victory was heavily dependent on a few decisions by the officials, which many saw as debatable.  One skeptical call would have placed the Cowboys on the Packers’ 1-yard line, but instead led to a change of possession and the Packers’ victory.\nThe final game of the week featured one of professional football’s most impressive quarterbacks once again deteriorate under pressure. Hoping to make it back to the Super Bowl once more, the Denver Broncos hosted the Indianapolis Colts, ending the game with a discouraging loss of 24-13. \nAfter last year’s abysmal Super Bowl appearance, some feared that Broncos’ quarterback Peyton Manning might prove unable to lead the team when it really counts. Sadly, those fears came to fruition, as Manning was unable to put up more than one touchdown and 211 yards, making it one of his most disappointing games given the stakes.\nNext Sunday, the Seattle Seahawks will host the Green Bay Packers at 3:05 P.M., while the Indianapolis Colts will head to New England to face the Patriots at 6:40 P.M.']",['https://knightnews.com/2015/01/nfl-round-up-four-teams-remain-before-superbowl/'],0.15393276512622833,0.04756315052509308,0.047686029225587845
1491,UCF,2015-01-19,journal_data/txt/UCF/2015_01_19.txt,"['The two championship games we’ve had this weekend could not have juxtaposed each other anymore perfectly. \nThe first match-up of the Green Bay Packers versus the Seattle Seahawks proved to be one of the most tense endings this season, while the Indianapolis Colts’ attempts to keep the New England Patriots from another Super Bowl appearance ended in shame and misery.\nHeading into this week, no one would have expected the Seahawks to be playing as poorly as they did. With four interceptions by the end of the game, Russell Wilson did little to provide hope for any Seahawks’ fan, failing to establish any momentum until the final 4 minutes of the game. Suddenly, everything appeared to swing their way. Wilson was able to lead one unstoppable drive, ending with a rushing touchdown from the man himself, before a successful onside kick led to another stellar rushing touchdown courtesy of Marshawn Lynch.\nYet Green Bay refused to concede, even then. With a little over one minute left in play, along with all their timeouts, the Packers were able to secure one last field goal, tying up the game, with a score of 22-22 and sending it into overtime. However, the Seahawks comeback could not be stopped, as they managed to score on the first drive of overtime, ending the game with a final score of 28-22.\nAfter such a high energy finish to the day’s earlier game, it would have been nice to see a close match between long time rivals like the Indianapolis Colts and the New England Patriots. Unfortunately, the game we were forced to bear witness to featured no level of competition or tension. Instead, we were handed a slaughter, as the Patriots dominated the Colts with a final score of 45-7.\nIn only two weeks, we will finally see the return of one of the year’s biggest television events. The Super Bowl will take place on Sunday ,Feb. 1, at 6:30 p.m. on NBC.']",['https://knightnews.com/2015/01/patriots-and-seahawks-heading-to-super-bowl-xlix/'],0.10239210724830627,0.05902319401502609,0.015033800154924393
1506,UCF,2015-02-08,journal_data/txt/UCF/2015_02_08.txt,"['The UCF Knights will be well represented at the 2015 NFL Combine.\nAccording to the NFL official invite list, former UCF football players Breshad Perriman, Jacoby Glenn, Rannell Hall and Clayton Geathers all received invitations to the 2015 NFL Combine. \nThe four Knights join a list of over 320 total invites. Each player will go through a series of drills and interviews, including psychological testing, bench press and on-field speed drills. \nPerriman and Glenn both opted to declare early for the NFL Draft, while Hall and Geathers both completed their full-time as UCF Knights. \nThe NFL Combine will be held Feb. 17 to Feb. 23 in Indianapolis, IN.  ']",['https://knightnews.com/2015/02/ucfs-perriman-glenn-hall-and-geathers-receive-nfl-combine-invitations/'],0.38144510984420776,0.06043035537004471,0.025137515738606453
1514,UCF,2015-02-16,journal_data/txt/UCF/2015_02_16.txt,"['Former UCF wide receiver Breshad Perriman could potentially hear his name called in the first round of the 2015 NFL Draft.\nLast year, former UCF QB Blake Bortles was selected No. 3 overall by the Jacksonville Jaguars in the 2014 NFL Draft, but some NFL analysts could also see Breshad Perriman being selected in the first round of the draft.\nESPN’s Mel Kiper’s insider draft board currently has Breshad Perriman going No. 15 overall to the San Francisco 49ers. \nNFL.com senior analyst and former VP of player personnel for the Dallas Cowboys, Gil Brandt, praised Perriman on Twitter, noting that he comes from the pedigree of his father, Brett Perriman, who played 10 NFL seasons.\n“UCF WR Breshad Perriman is ascending. Father Brett played in NFL for 10 years, 2nd-round pick. No surprise if Breshad went in 1st,” Brandt said on Twitter. \nPerriman has a chance to increase his draft stock further this upcoming Wednesday, Feb. 18, at the NFL combine in Indianapolis, IN. Perriman will join former UCF players Rannell Hall, Jacoby Glenn and Clayton Geathers at the combine. ']",['https://knightnews.com/2015/02/former-ucf-wr-breshad-perriman-generating-first-round-nfl-draft-buzz/'],0.31884369254112244,0.020055526867508888,0.026919404044747353
1570,UCF,2015-04-22,journal_data/txt/UCF/2015_04_22.txt,"['A University of Central Florida director and author of an ethics textbook has resigned after accusations of misusing funds and university resources, according to documents obtained by KnightNews.com.\nDr. Robert Chandler, the Nicholson School of Communication director in the College of Sciences, turned in his letter of resignation on March 25 after a six-month investigation by UCF.\n\nIn a March 18 letter to Chandler, College of Sciences Dean Michael Johnson outlined a number of accusations brought against Chandler such as the misuse of travel reimbursements.\nOut of 113 trips he has taken since his start at UCF in 2009, he is being accused of “double-dipping” on travel expenses for 40 trips by asking for payments from both UCF and a third party organization. As a result of the investigation, Chandler reimbursed UCF about $30,000 for the “overpayments and double payments” he received, according to Johnson.\nUCF was helping to pay for trips that Chandler was taking all around the world, including to India and Hawaii. Chandler received funds for airline tickets, hotel, meals, taxis, tolls and parking.\nIn a July 2010 trip to Hawaii, he received over $4,000 from a third party organization to present a paper at the 2010 Disaster preparedness Conference in Honolulu. His airfare ticket was over $1,000, where he charged an additional $330 ticket upgrade fee, according to records.\nIn February of this year, he reimbursed UCF over $1,800 for the Hawaii trip, according to records.\n“With roughly 40 counts of ‘double-dipping’ on your travel expenses, it is impossible for me to accept an explanation of ‘sloppiness’ on your part,” Johnson said in the letter.\nIn addition to Chandler’s travel expenses, Johnson accused Chandler of using UCF employees to work on his outside projects, including having an employee “author” at least one chapter in Chandler’s book of which UCF did not benefit from, according to records.\nHe was also accused of hiring family members, which violates university regulations.\nIn a 10-page letter Chandler sent with his resignation notice to Johnson, Chandler addressed and denied all the accusations made against him.\n“…I deny your claims that my delays arose from a purposeful fraudulent intent,” Chandler said. “I deny your claim that I had ‘never’ previously reimbursed or not sought reimbursement from UCF for expenses paid by other parties until December 2014.”\nJohnson announced Chandler’s resignation to faculty in a meeting on March 27, according to NSC Area Coordinator and Associate Professor Steve Collins. Collins said Johnson told faculty Chandler’s resignation involved financial issues but were given no more details.\n“[Johnson] said this is not the first time someone has resigned from investigation,” Collins said. “I specifically asked if he thought, hindsight being 20/20, there were signs or someone could have found out sooner and he said he didn’t think so.”\nCollins continued: “I can tell you I am skeptical of that but I am not in a position to say.”\nThis is not the first time a UCF administrator was accused of misusing university funds.\xa0\nIn 2009, College of Engineering Dean Jamal Nayfeh was accused of using a UCF credit card to buy more than $40,000 in electronics for his home. Nayfeh turned himself into the Orange County Jail on theft charges, UCF said. In Chandler’s case, the investigation is ongoing and no criminal charges have been filed.\nKnightNews.com reached out to Chandler through multiple avenues, including knocking on his door, to comment on these accusations. When KnightNews.com arrived at his home Wednesday evening to ask for comment, Chandler refused to open the door, fleeing from his home’s patio to the upstairs.\nChandler is a Crisis and Emergency Communication Scholar and professor of communication, and makes a yearly salary of $201,058.72. Chandler is currently on administrative leave. In the meantime, College of Science Associate Dean Dr. Arlen F. Chase, who specializes in anthropological archaeology, is acting director.\nChristal Hayes contributed to this report.']",['https://knightnews.com/2015/04/records-ucf-director-resigns-after-allegations-of-misusing-funds/'],0.5625050663948059,0.4599865674972534,0.41719552874565125
1626,UCF,2015-07-05,journal_data/txt/UCF/2015_07_05.txt,"['Faced with the death of a loved one, when UCF student Chloe Arenas tragically lost her life in a retention-pond crash, family and friends of the 21-year-old have begun the journey of proposing legislation that would prevent loss of life in\xa0identical, future\xa0accidents.\nSunday, June 28 saw the biomedical-sciences student leave her friend’s house at 4 a.m. to pick up her mother and grandmother for a trip to Nicaragua.\nAn hour later, she would abruptly lose control of her Hyundai when approaching the 408 exit ramp onto N. Alafaya Trail, leading the car to plunge into a retention-pond across the interchange. Tow trucks arrived at the scene to assist\xa0emergency vehicles in the retrieval\xa0but were unable to recover the car in time.\nTaking charge of the proposal is Clarissa Lindsey, Arenas’ best friend since they were two years old.\nThe Arenas family held a memorial service for their loved one on Friday, July 3 where\xa0family and close friends honored Chloe’s life. At the service, Lindsey and the Arenas family made public their journey to proposing a law in tribute to their Knight – Chloe’s Law.\n“Chloe’s law aims to require the implementation of guard rails along dangerous bodies of water that accompany road ways in Florida,” Lindsey said.\xa0“This is an ongoing issue in Florida, being that the National Highway Traffic Safety Administration states that Florida is the most dangerous place in the nation regarding victims who drown in submerged vehicles.”\nIn 2011, the National Highway Traffic Safety Administration reviewed crash data and death records from 2004 to 2007 and concluded that Florida averaged 57 deaths by drownings in those years, with 384 deaths occurring nationwide.\nThe Orlando Sentinel continued a review of the federal crash data, surveying records from 2008 to 2012, finding that Florida again topped the nation with 49 drownings inside vehicles during the five-year period. Texas came in a distant second with 18 deaths followed by Indiana with 14 deaths, and Louisiana and Arizona with 10 deaths in each state, the Orlando Sentinel reported.\nArenas began classes at UCF in the summer of 2012 and enrolled in courses at Valencia College on a path of becoming a veterinarian.\nDriven by a passion for zoo and domestic animals,\xa0she could be seen caring for many, including her bearded dragon, dog and a cat that she found alongside a road, with dreams of one day treating elephants in Africa.\n“Though I am confident that this law will save many lives, it will be a success if we are able to save only one,” Lindsey said.\n“The next step in the process is to finish the research and completion of the first draft of the policy proposal. I plan to seek out House representatives and senators in support of this beneficial and necessary bill.”\nA Change.org\xa0petition has been made in support of the proposed bill.\nPhoto courtesy of Clarissa Lindsey\n–\nBill’s official filing – ‘Traffic Safety Law Officially Filed in Memory of UCF Knight’']",['https://knightnews.com/2015/07/family-friends-of-fallen-ucf-student-begin-push-for-proactive-legislation/'],0.04349270462989807,0.043190352618694305,0.030210500583052635
1658,UCF,2015-08-13,journal_data/txt/UCF/2015_08_13.txt,"['Walt Disney World’s shopping and entertaining complex will no longer be called Downtown Disney starting this fall. \n“Starting this month, you may notice the name ‘Disney Springs’ will begin to appear on guide maps, brochures, roadway signs and other places,” a Disney World spokeswomen told the Orlando Sentinel Wednesday. \nThe revamped area is based on the look of an early 20th century Florida town, according to the Orlando Sentinel. \nThe new remodeled complex will include two parking garages, several retail outlets, and new restaurants. \nExpected to open this fall are Morimoto Asia, a Pan-Asian restaurant, and Jock Lindsey’s Hangar Bar, an aviation-themed lounge featuring a pilot character from “Indiana Jones,” according to the Orlando Sentinel. ']",['https://knightnews.com/2015/08/downtown-disney-to-renovate-and-change-name/'],0.22587411105632782,0.024886861443519592,0.04255566745996475
