,school,date,txt_file,matching_text,matching_links,positive,negative,neutral
795,UCF,2012-09-14,journal_data/txt/UCF/2012_09_14.txt,"['If you ever asked yourself where the idea of equal rights stemmed from, and its relation to democracy in India, Indian author and historical anthropologist, Anupama Rao, addresses these questions.\n“All modern society’s face this kind of dilemma, or dichotomy, which means protecting people’s individual rights on the one hand and having commitment to social responsibility, to also enhancing the rights of particularly culturally, marginalized groups,” Anupama Rao said.\nIndian author Anupama Rao addressed caste, violence and democracy in a speech to 125 people in the Pegasus Ballroom in the Student Union on Thursday, Sept 13.\nIndia is the largest democracy that views cultural rights, individual rights, and group rights differently than what we see in the United States because of a caste system that is central to affirmative policies.\n“The idea of equal citizenship was always constrained by the practice and experience of inequality, this is another dilemma that you have the idea of equal citizenship but is constantly confronting historical practices and experiences of inequality,” Rao said.\nHer speech, “India and the Caste Question”, was sponsored by the UCF Global Perspectives Office.\nRao’s academic background is in anthropology and history, and she is an associate professor of South Asian history at Barnard College, Columbia University. She has served as president of the Society for the Advancement of the History of South Asia. Currently, Rao is working on a project titled Dalit Bombay, which focuses on the relationship between caste, political culture and everyday life in colonial and postcolonial Bombay.\nRao said she tells her students that India’s affirmative action regime, dating back to the 1880s, in which “princely states in southern India used the argument that proportionally representation to provide jobs and education to lower castes had been excluded by the British Bureaucracy”.\nIndia tried different methods to manage the country’s complex and repeating forms of diversity by presenting the idea of equality through multifaceted multi-religious, multi-ethnic and deeply hierarchical social order. In other words, producing social revolution through legal means.\nIndia has a large demographic of lower castes and dalits, or ex untouchables in which they have been challenging the control of schools, jobs, government and representation of media by the social elite and upper caste.\n“In order to understand Indian democracy, you have to understand the caste. The caste has been central to the way that Indian democracy has worked, caste has been central to the way that people have tried to produce democracy in India,” Rao said.\nGhandi believed reform required the repent of Hindus against such caste systems, not through political solutions, stating that the practice of untouchability dehumanizes those who practice it, not the individual who endures it. .\n“Effort to give the untouchables separate representation in 1932, failed because of the spectacular fast into death undertaken by Ghandi which became a global issue, and everyone, of course, wanted to make sure that Ghandi does not die,” Rao said.\nThis was opposite to B.R. Ambedkar, one of India’s most radical thinkers, and also an ex untouchable, or dalit, India’s first law minister and chairman of drafting committee of India’s consitution. Anti-caste radicals, the tradition that Ambadker came from, were inspired from new world struggles against racial servitudes.\n“Anti-caste radicals draw typologies of race, and argue that the relation between upper castes and lower castes was like a racial conflict between black and white,” Rao said\nThe language of slavery was also used to describe sexual subjugation, and Ambadker compared life on African American plantations to the caste system. History of emancipation in the Americas gave multi-caste and anti-caste radicals a different approach to the Hindu upper caste cultural nationalism.\n“These were global thinkers and global people who may have not traveled physically but they did indeed travel in their thought very widely,” Rao said.\nThe dalit approach was to take the practice of untouchability outside of religion and into social and political inequality. Unlike Ghandi, activists demanded access to public institutions, such as hotels, schools, water tanks and temples. Arguing that public property enabled these rights, regardless of caste system.\nDalits who participated in protests, would return home to find their huts burned or boycotts on their entire community for participating in acts of protests.\n“The activism around public facilities, which is very much like the activism in the United States with access to public sources and government property, shouldn’t obscure the very sophisticated ways in which dalits addressed inequality within religion itself,” Rao said.\nDalits, between 1928 and 1935, began to enter temples claiming that temples were like any other public space they had access to, disregarding the inequality of religious practices. Questioning their own validity as Hindus, since they had been barred from worshipping in temples. Temple entry was an act to make individuals aware of the inequality.\nHowever, colonial law maintained that Hindu temples were private property and were therefore allowed to practice caste segregation.\n“Should remind many of us about the history of race, and racial exclusion in the United states, and the way that the legal conversations around important cases around U.S civil rights were perceived in the very same manner in which was happening in India,” Rao said.\nAmbedker had written that political democracy cannot last unless there is social democracy.\nIn 1956, half a million people, along with Ambedker, arrived in Nagpur, clean and dressed in white to symbolize rebirth as they rejected Hinduism and converted to Buddhism.\nRao suggested, that like the United States, the history of inequality in India has produced a story of democracy.\nThe model of affirmative action in India is distinctive, because the policies are addressed to a majority who has suffered inequality, and the untouchables were also written into the constitution as persons requiring special rights.\nAccording to Rao, “this produces a very different understanding of the relationship between individual rights and group rights, and produces a different model of how society thinks about the project of responding to inequality. This in a sense has been the history of the relationship between caste and democracy”']",['https://knightnews.com/2012/09/author-discusses-caste-and-democracy-in-india/'],0.5086074471473694,0.6515536308288574,0.34456223249435425
819,UCF,2012-10-11,journal_data/txt/UCF/2012_10_11.txt,"['It seems like a lot of us are grasping for the next big health kick, whether it’s embracing a new exercise routine, or opting for organic produce.\nYou can now add kombucha to the list, a naturally carbonated tea that is a smarter and healthier option to carbonated sugar water.\nKombucha has been around for thousands of years, dating back to 221 B.C during the Chinese empire of the Tsin-Dynasty, and they called it “the remedy for immortality” or “the divine tische”. It was later brought to Japan by Dr. Kombu to treat the Japanese emperor, Inkyo, for digestive problems, and it later spread to Russia, India and Europe. Don’t worry, you don’t have to travel far to achieve immortality; Central Florida based Farm Boy Produce brews and sells it locally.\nEssentially, kombucha is fermented green or black tea comprised of a sea of health giving organic acids, vitamins, minerals, enzymes and nutrients. It also contains healthy bacteria in the form of Lactobacillus Acidophilus, as well as a dozen other probiotic strains. Kombucha carbonates naturally once bottled because it continues to ferment and release carbon dioxide that becomes trapped.\n“One of the byproducts is cellulose, as the stuff ferments, you have this production of the cellulose which ultimately accumulates on the surface layer and actually forms like a gasket on the surface, which is almost completely impervious, even with a really sharp knife its tough to slice through it, and its just the cellulose network that people refer to as the kombucha, mushroom,” said Mark Bevilaqua, founder of Farm Boy Produce, and producer of kombucha.\nSome of the benefits to drinking kombucha are that it improves digestion, boosts energy, improves circulation, prevents acid reflux, improves sleep, and it boosts the immune system.\nAccording to Food Research International, Russia conducted a series of studies in the 1900s and mid 1900s .One study was based on a remote area of Russia that was poverty-stricken, therefore had shortages of food, but the people were big consumers of kombucha. Scientists found that the people consuming kombucha in this area had no instances of cancer, and had healthy immune systems. During World War I, Russia’s secret home remedy was referred to as the “Wonderdrink” because it helped treat headaches, gastric illnesses, and regulated intestinal activity.\n“Ultimately the results of these studies were released and then they were tested and actually proven, in Netherlands, Germany, Poland, the news or the knowledge that kombucha, that fermented tea ultimately cures, prevents, cells from mutating, increases immune system function, all this stuff that has been proven by multiple scientific groups for almost half a century, basically the knowledge has been there,” said Bevilaqua.\nHowever, not all kombucha is made the same. The benefit of buying locally brewed kombucha is that it is not pasteurized. Mainstream kombucha available on store shelves are all pasteurized, therefore killing off all the beneficial bacteria. According to Bevilaqua, it’s like drinking soda with b vitamins.\nFarm Boy Produce uses reverse osmosis system, filtered water with the lowest dissolved solids, organic tea and sugar bought directly from producer or distributor. Their kombucha is available on draft or bottled in the following flavors: ginger soda, honey ginger, honey mate, yerba mate, spiralina, grape and apple cinnamon. You can find it on draft at Drunken Monkey or Redlight Redlight Beer Parlour. Bottled kombucha is available at Audubon Park Farmer’s Market, Hoover’s Market and Homegrown Co-op.']",['https://knightnews.com/2012/10/kombucha-your-way-to-better-health/'],0.08856507390737534,0.006662474013864994,0.013042244128882885
826,UCF,2012-10-20,journal_data/txt/UCF/2012_10_20.txt,"['A controversial new flask designed to look like an iPhone so students can hide it from police patrolling for illegal drinking during tailgates is being marketed to University of Central Florida students. \nKnightNews.com has learned the developers of the “iFlask” are advertising the product online, targeting UCF students. In a promotional video posted on the iFlask’s kickstarter.com webpage, the product’s co-founders promote how the iFlask could help prevent police from giving out tickets during tailgates.  \nThe iFlask contains enough space to fill it with about five shots, according to co-founder Daniel Novaes, who although just recently graduated from the Kelley School of Business at Indiana University in 2011, is not new to business. “Prior to inventing iFlask Daniel founded Elekteks Inc which produced over $2 million in revenues in 2011,” according to the iFlask webpage. \nKnightNews.com wants to know what you think of this product being marketed to UCF students. Email us at news@knightnews.com or share your comments below. ']",['https://knightnews.com/2012/10/iflask-looks-like-iphone-designed-to-hide-liquor-during-tailgates/'],0.006190132349729538,0.085422083735466,0.005565027240663767
828,UCF,2012-10-22,journal_data/txt/UCF/2012_10_22.txt,"['Students enjoying “Music Monday” in the Student Union heard more than the familiar sounds of the Union’s piano, thanks to the Student Opera Club.\nAbout 15 members of the club surprised unsuspecting students with a flash mob, performing their rendition of “Libiamo ne’ lieti calici”, from the opera “La Traviata.”\n“The Student Opera Club has always kind of existed but no one has ever done anything with it,” President of the Student Opera Club Daniel Johanson said. Johanson helped organize the flash mob because he wanted to make the school aware that the Student Opera Club exists while showing that opera is not highbrow or elitist.\n“I’ve been doing opera for a while and a common stereotype is a certain kind of person is in to it,” Johanson said. “I want to make opera more accessible.”\nThe performance was about four minutes long and featured 8 solos, all singing the famous Italian melody. The Student Opera Club has been planning the event throughout the semester at their meetings, which occur twice a week. The organization has about 32 members, and to adapt to music majors’ busy schedules they meet on Mondays at 2 p.m. and Thursdays at 3 p.m. in room M16 of the music building.\n“A lot of music majors are very busy so it’s hard to get everyone’s schedule together,” Johanson said. Johanson is taking just nine credit hours this semester, however he is constantly busy between taking classes, leading the Opera club, and singing in both the Florida Opera Theater and at local churches. Vice President India Holoman, a music performance major, also adheres to a busy schedule, but she says her dedication to music is a labor of love.\n“I love this major. I don’t think I’ve ever been this happy in school,” she said. Holoman said that operas have exciting plotlines that students may find entertaining. “When I tell people I sing classical music they say, ‘what?’” Holoman said. “I don’t think people realize opera can be very, very funny.” \nIt is also intense. Holoman referenced the opera “Don Giovanni”, which begins with the title character raping a woman and killing her father, all in the first scene. These plotlines may be hard to pick up on when performed in Italian, and Opera students take Italian and diction courses to learn to properly sing the language.\nFor Tamra Pristou-Globokar, the self-described “super-senior” prefers to keep her interest in music as a hobby. Pristou-Globokar is a digital media major who joined the club this semester.\n“It’s the flash mob that got me into the club,” she said. Pristou-Globokar played the trumpet for the UCF Marching Knights for four years, but after leaving the band she joined the opera club to indulge her interest in music. Nickolaus Hofmann, a music education major, also fulfills his interest in opera music, which he considers beautiful singing. Hofmann recommends that students use music applications like Spotify to listen to classical music.\n“They get scared by it,” Hofmann said. “If people are more brave they can give it a chance.”']",['https://knightnews.com/2012/10/student-opera-club-surprises-with-flash-mob-in-union/'],0.7810845375061035,0.6084168553352356,0.08882449567317963
843,UCF,2012-11-07,journal_data/txt/UCF/2012_11_07.txt,"['Modern day slavery is a hard issue to talk about, and seems like the sort of thing you want to turn away from, says Corban Addison, author, lawyer and human rights activist.\nThere are 22 to 32 million sex and labor slaves in the developing world, and developed world, including the United States.\nUnderstanding human trafficking as the fastest growing industry due to challenge of demand and challenge of priority can hopefully cause a cultural revolution, said Addison, in an open forum on Thursday in the Cape Florida Ballroom at the Student Union.\n“The whole story is supply, distribution and demand, someone is willing to pay for this product, in this case, humans,” Addison said.\nThe open forum was sponsored by the UCF Global Perspectives Office and is part of the 2012-2013 theme “The Changing Face of Freedom in Today’s Turbulent Times”.\nAddison is the author of the novel titled A Walk Across the Sun a cultural story based in India with a fictional account of the horrors of modern day slavery.\n“My awakening came in a number of stages,” Addison said. After watching the 2007 film Trade with Kevin Cleine about young teens bound in the ugly world of sex trafficking, Addison realized, “these kids are not fundamentally different from my own.”\nAddison visited India, Europe and Washington D.C to witness and research the global trade. In Mumbai he went undercover to brothels to hear the victims stories.\n“Slavery has a human face, they’re not just statistics and stories,” Addison said. He continues by saying that average age of entry in sex trafficking is 13 to 15, including the United States.\n“Reality is, billions of dollars are coming from the buyers,” Addison said, addressing the challenge of demand by “ordinary American men, people who look like me”.\nAddison says it is not just the criminals fueling the industry, but all people stating, “we are the solution”.\nHe also said that challenging priority is just as important to ending human trafficking.\n“We spend more money, annually on outfitting our military marching band, more money is spent in one month on the war against drugs, than we have ever spent on rescuing our children or other people in our own shores and around the world,” Addison said.\nAddison hopes to educate others, and for others to pass on their knowledge with the effort to eventually rid the world of human trafficking.\n“I want to see more awareness, because like he said, it’s a big underground community that is in this fight that is behind this veil curtain, so to speak, so you don’t really know about it, and I didn’t really know about it until I was 20 years old,” said Geoffery McDole, criminal justice student and an intern with International Justice Mission and component for fighting human trafficking since reading the manuscript for A Walk Across the Sun.\nInternational Justice Mission was one of Addison’s bases for his novel.\n“One of my big issues is comprehensive immigration reform, and I think this ties into that because a good portion of the human trafficking are immigrants, often times undocumented, this is an important issue for me, and I hope to be part of the solution,” said Melissa McGuire-Maniau, immigration reform activist, undergraduate in international affairs at Rollins College.']",['https://knightnews.com/2012/11/author-human-rights-activist-talks-modern-day-slavery/'],0.6084585189819336,0.36878934502601624,0.06254810839891434
878,UCF,2012-12-20,journal_data/txt/UCF/2012_12_20.txt,"['The UCF Knights (9-4) are set to take on Ball State (9-3) in the Beef O’Brady’s bowl Friday at 7:30 p.m. at Tropicana Field in St.Petersburg, FL. \nThe Knights are no stranger to the Beef O’Brady’s bowl, as they just played in the bowl in 2009 when they lost to Rutgers 45-24. Ball State will be making their first bowl appearance since 2008 when they lost to Tulsa 45-13 in the GMAC bowl.\nThe Knights won the Conference USA East Division this year for the fourth time since joining the league in 2005. Although they lost to Tulsa in the Conference USA championship, their 9-4 record proved to be good enough to send them to their fifth bowl appearance in the last eight seasons.\nThe Ball State Cardinals from Muncie, Indiana are currently riding a six game winning streak dating from October 6th when they lost to Northern Illinois 35-23.\nKeys to Knights victory:\nThe Knights are no stranger to the endzone this season, averaging 35.2 points per game which puts them 27th in the nation. A big reason for these numbers is the bigger role and responsibility on behalf of Sophomore QB Blake Bortles who has thrown 22 touchdowns on the season.\nIf the Knights can get the run game going with running back Latavius Murray taking the brunt of the carries and getting the ball to leading receivers J.J. Worton and Jeff Godfrey, the Knights should have no problem putting points on the board. \nThe Ball State Cardinals have allowed at least 20 points in every game this season, so that should bode well for the Knights offense. \nDefensively, the Knights may have a tough assignment against Ball State quarterback Keith Wenning who missed the Cardinals’ last regular-season game after having surgery on his fractured right ankle. Wenning has shined this season, throwing for 2,878 yards and 22 touchdowns. If the Knights can contain the Ball State passing attack and force the Cardinals to punt, C-USA Special Teams player of the year Quincy McDuffie will have a chance to show off his flashy kick/punt returns.\nFinal thoughts:\nThe Knights have an obvious home field advantage, being that St.Petersburg is only 125 miles away from campus. The match-up is pretty even, with the Knights favored by 7. Ball State will have a tough time stopping UCF from putting up lots of points, with the Knights having a myriad of scoring options on offense and even special teams. It doesn’t help the Ball State case when Kemal Ishmael, voted UCF’s Most Valuable Player, is lurking in the backfield against Keith Wenning who has thrown 10 interceptions this season.\nThe game will be close, but UCF will prevail on the intangibles and capitalize on Ball State turnovers, final score: UCF 31, Ball State, 27.']",['https://knightnews.com/2012/12/beef-o-bradys-bowl-preview-keys-to-a-knights-victory/'],0.3710009455680847,0.11774816364049911,0.07312772423028946
890,UCF,2013-01-15,journal_data/txt/UCF/2013_01_15.txt,"['A new report lists the University of Central Florida as one of the top communities in the nation experiencing rapid growth in “sugar daddy” and “sugar baby” involvement. \nSeekingArrangement.com released a new report that ranks UCF fourth on a list of fastest growing sugar baby school in the nation. The site aims at  helping “sugar daddies” meet “sugar babies.” Originally aimed at putting local college students in touch with “sugar daddies” and “sugar mammas,” SeekingArrangements.com now works on a national level with hundreds of postings in both parties.\nThe site provides in-depth information on how exactly it works.\n“Because of how our society works, it is awkward for someone to walk up to another to ask them if they would like to get involved in a Mutually Beneficial Relationship. That is where SeekingArrangement.com comes in. Our website provides a secure place for like-minded Sugar Daddies, Mommies and Sugar Babies to meet each other,” the website states.\nA sugar baby is a young female or male who is financially pampered/cared for by a sugar daddy or sugar mama in exchange for companionship. A “sugar daddy” or “sugar momma” is a professional businessman or businesswoman who serves as a “mentor, sponsor or benefactor” to that younger man or woman.\nThe top ten sugar baby universities in the country are:\n1. Georgia State University\n2. New York University\n3. Temple University\n4. University of Central Florida\n5. University of South Florida\n6. Arizona State University\n7. Florida International University\n8. University of Georgia\n9. Indiana University\n10. Texas State University\nAccording to SeekingArrangement.com, 291 students at UCF use the web site and 221 students joined in 2012.\nDid you come to UCF to be a sugar baby? Send us a message and talk to us or let us know what you think!']",['https://knightnews.com/2013/01/ucf-part-of-growing-sugar-daddybaby-community/'],0.053424376994371414,0.027943748980760574,0.047202274203300476
896,UCF,2013-01-23,journal_data/txt/UCF/2013_01_23.txt,"['UPDATE\nUCF’s appeal hearing before the NCAA is complete. The hearing lasted about 3.5 hours and there is no timetable for a ruling.\n“We look forward to the outcome of the appeal, knowing that we presented a strong case on behalf of our student-athletes, athletics program and fans,” UCF spokesperson Grant Heston said.\nKnightNews.com will continue to follow the appeal.\nThe NCAA is set to hear UCF’s appeal of the one-year postseason ban that was imposed on the football program following allegations of shady recruitment tactics, according to a UCF spokesperson.\nOn Wednesday, Grant Heston said that UCF President John Hitt, athletic director Todd Stansbury and others will attend the hearing at NCAA headquarters in Indianapolis on Thursday.\nIn July of 2012, the NCAA imposed a series of sanctions against the UCF Football and Basketball programs after the NCAA’s Committee on Infractions determined the school committed major recruiting infractions which ultimately forced UCF athletics director Keith Tribble and wide receivers coach David Kelly to resign.\nUCF only challenged the postseason sanction placed on the football program, although other sanctions were levied such as a one-year postseason ban in basketball, $50,000 fine, five years probation, reduction of basketball scholarships and limits on football recruiting.\nUCF was allowed to play in the 2012 postseason after deciding to appeal the punishment imposed against the program. The NCAA does not impose punishment during pending appeal.\nKnightNews.com will keep you updated with any information that arises on Thursday.']",['https://knightnews.com/2013/01/ncaa-to-hear-ucf-appeal-of-football-postseason-ban-thursday/'],0.0941232293844223,0.07746680080890656,0.03894658386707306
