,school,date,txt_file,matching_text,matching_links,positive,negative,neutral
32,UCF,2009-08-26,journal_data/txt/UCF/2009_08_26.txt,"['Pegasus Palooza’s Monday event was a huge hit, as hundreds of students gathered at the UCF Venue to enjoy a very amusing show. \nThis comedy event began with an opening act from two of the guys of College Humor, Streeter Seidell and Jeff Rubin. They showed a few of their favorite pictures and videos that fans have submitted to their Web site, collegehumor.com, and even got interactive with the audience.  \nThree volunteers went on stage to participate in a little trivia game to win a $25 Apple gift card. \nThe first contestant was asked to name five Weird Al songs, which he was able to do with some help from the audience. \nThe second was a girl so she was given the only “girl question,” which was to sing a Hannah Montana song.\nShe ended up singing a few lines from about three different songs, but managed to get the prize. \nThe last contestant was asked what seemed to be the easiest question, but he still struggled with it for a bit. He had to say where the latest season of The Real World was taking place. After a few moments, and some shouting from the audience, he was finally able to say “Cancun.”  \nAfter the audience was all warmed up, the guys from Broken Lizard came out. With their ample use of profanity and obscenity, they kept the audience laughing from beginning to end. \nTheir entire show was composed of various smaller skits, which altogether lasted well over an hour. Their skits ranged from topics including masturbation, sex, drinking, drugs, parodies of the ancient Greeks and of computer help hotlines operated by people in India. \nSome of their humor was offensive, but that didn’t seem to bother anyone too much.  \nThe guys from Broken Lizard also had three volunteers go up to stage to help out. These had to read a short phrase with the best German accent they could do. After this, they participated in a small drinking competition against three of the guys of Broken Lizard. \nThe first participant had to empty his entire cup — of non-alcoholic beer of course — and then place his cup upside-down on his head before the next person in his team could do the same. The first team to go through all three members would win. \nUnfortunately, the students lost.  \nThe entire event was a success and everyone was making positive comments about it, and about how glad they were to have gone. Many were already fans of Broken Lizard, so to them it was a great experience to have seen them live. And those who hadn’t heard of the group are now their newest fans.\nBroken Lizard consists of five members: Jay Chandrasekhar, Kevin Heffernan, Steve Lemme, Paul Soter and Erik Stolhanske. They began as a student sketch comedy group at Colgate University and have continued to be very successful in what they do. \nThe group has created some hysterical films such as Puddle Cruiser, Super Troopers, and Beerfest. They are currently working on their latest film, The Slammin’ Salmon, which comes out sometime this year.']",['https://knightnews.com/2009/08/broken-lizard-brings-big-laughs-to-ucf/'],0.233385369181633,0.26013267040252686,0.09646404534578323
79,UCF,2009-10-22,journal_data/txt/UCF/2009_10_22.txt,"['Dr. A.P.J. Abdul Kalam, the former president of India and an aeronautical engineer, gave a presentation entitled “World Space Vision 2050” to UCF students on October, 22 in the Pegasus Ballroom of the Student Union.\nAfter a brief introduction from President Hitt, Kalam asked what UCF students would be remembered for. He said that it would be something different; some out of the box missions, but that there were many possibilities as to what it could specifically be.\nThe list on his slide was as follows:\n-Visionary action for the nation\n-Creating an aerospace system for exploring Mars\n-Making solar energy from space possible and safely transmittable to Earth\n-Creating a lunar or Mars penetrator to find water\n-Unifying Earth, the moon, and Mars\n-Making Earth better with space technology\n-Utilizing valuable resources in our solar system\n-Becoming entrepreneurs of space technology\n-Conducting basic scientific research in space\n-Protecting space assets\n-Establishing competence in space human resources\n-Bringing down the cost of access to space\nHe then asserted the importance of viewing the globe as a single entity and establishing a world community. Kalam stated that the future of space travel lies in cooperation between the nations with space programs.\nThe next argument was that the Earth had two needs: Protection of the environment for living and energy.\nHe showed graphs detailing how the stratosphere is cooling and the troposphere was warming, and claimed that burning fossil fuels leads to 30 billion tons of carbon dioxide annually. Though frightening figures, Kalam proposed that improved space technology can actually help the crisis, such as by helping us settle on Mars. In order for this space travel to improve, however, we need a dramatic reduction of cost, which he elaborated on later in the presentation.\nKalam then revealed his actual initiative, World Space Vision 2050, a three-part proposal to improve space travel and international relations.\nThe three facets were:\n-Large scale societal missions and low cost access to space\n-Comprehensive space security\n-Space exploration and current application missions\nKalam argued that the cost of access to space would be lessened over time by new advances, but also by introducing reusable launch vehicles (RLV), that can be launched more than once, thus reducing the number of space vehicles that need to be produced.\nThe RLVs would be able to lift off, like conventional airplanes, on runways and explore energy sources in space. Another cost-saving aspect of the RLVs is their ability to collect and liquefy oxygen in space, negating the necessity of returning to Earth for more oxygen.\nSpace satellite service stations would be created for all satellites in the GEO as a permanent international facility. These stations would extend the life of satellites by providing in-orbit maintenance such as diagnosis, replacement, recharging, powering, refueling, and de-boosting after use.\nHis next point was comprehensive space security.\nKalam made the distinction between “defense” and “security” by elaborating on his plan’s goal of protecting the Earth, not engaging in military competition. The proposed security involved averting dangers that arise, protecting space and global assets, prevent militarization of space, performing necessary space rescues, managing space debris, and monitoring and defending against asteroids.\nKalam then explained that steps can be taken now to ensure make these plans a reality. The first step is to use our current capabilities to undertake interplanetary missions. The second is to develop more international cooperation, especially on projects that go beyond a global scale. The third step is to continue exploring space, and trying to provide current applications to the missions that we undertake.\nIf these steps are taken, Kalam believes that, in addition to scientific knowledge and advances, space travel can bring peace.\nThere was still some time after his presentation ended, so Kalam answered a few questions from the audience.\nThe first question dealt with concerns over the history of mankind, such as wondering if colonies in space would ever fight for independence. Kalam responded by saying that we need to work closely with those who are both developing the colonies and working on the science behind it to make sure that it is not an issue.\nThe second questioner asked if “space law” would become clearer in the future. Kalam responded positively, claiming that enhanced communications through satellites would make developing the laws much easier than earlier laws, which did not have the advantage of satellite communications.\nThe third questioner asked how we should go about getting politicians involved, especially those who do not believe that space travel is a big issue. Kalam responded by saying that democracies just need to make sure that their officials back them on these issues, especially because space travel can help solve other issues, such as energy sources.\nThe fourth questioner asked if there was Indian Astronauts were being actively pursued, to which Kalam suggested that Moon and Mars landings would be a great possibility. More so than nationality, he claimed, people needed to view “Earth, Moon, Mars as a single complex,” as opposed to worrying about nationality.\nThe fifth questioner asked if it was justifiable to spend so much money on space programs if the nation is in poverty. Kalam responded by saying that the space program, such as the case in India, can actually improve poverty, by creating jobs and increasing communication to impoverished parts.\nThe sixth questioner asked if future space endeavors would be funded by the private or public sectors. Kalam responded by saying that a World Space Council would control the funding, which consists of many governments.\nThe seventh questioner asked how space traffic would be dealt with, citing the example of hundreds of satellites, to which Kalam responded by proposing bringing nations together to make sure that it is not an issue.\nThe eighth questioner asked if humans would be able to survive the travel to places such as Mars. Kalam responded by claiming the colonization to be a long-term venture, and that with proper training it would be possible.\nThe ninth questioner asked if students were contributing to the future of space travel, to which Kalam responded that they are.\nThe tenth questioner asked if any large Indian companies, such as Tata Consistency, were contributing to space travel. Kalam responded by saying 500 industries have.\nThe final questioner asked how space could be protected, considering many major space companies have ties to the military. Kalam responded by saying that there would be a multinational defense force in space, to prevent any one country’s dominance.']",['https://knightnews.com/2009/10/former-indian-president-speaks-on-campus/'],0.8454206585884094,0.24261102080345154,0.5378763675689697
144,UCF,2010-02-04,journal_data/txt/UCF/2010_02_04.txt,"['It’s being billed as the best recruiting class in program history.\nWith 23 signees from three states among the 2010 recruiting class, the UCF Knights football program is hoping this crop of student-athletes will help raise the bar for years to come.\nAmong those becoming Knights under head coach George O’Leary during Wednesday’s National Signing Day were nine from Miami-Dade County; including five from Class 6A state runner-up Miami Central High School.\nThere were 18 signings in all that took place on Wednesday as five student-athletes had already enrolled at the school in January for the current semester.\nCommitments from the Central Florida area included quarterback Blake Bortles (Oviedo High School), defensive tackle E.J. Dunston (Edgewater High School), defensive tackle Andrew Rice (Lake Mary High School), and defensive back Jordan Ozerities and wide receiver Cornelius Whitehead, both out of Mount Dora High School.\nBelow is a look at the 2010 class, courtesy of UCF Athletic Department.\n– Remaining Close to Home – \nBlake Bortles, QB, 6-4, 222, Oviedo, Fla. / Oviedo\nPlayed for coach Wes Allen at Oviedo High School…Set Seminole County record with 5,576 career passing yards and 53 touchdowns… Ranked number eight in the Orlando Sentinel Central Florida Top 100 as a senior… A third-team all-state pick in 2008… Helped team to a 9-2 record senior year… Twice named all-county…Completed 151-of-233 passes for 2,211 yards with 27 touchdowns and seven interceptions as a senior…The MVP of the Central Florida All-Star Game…As a junior, threw for 2,400 yards and 24 touchdowns with nine interceptions while also running for 250 yards…Team was district champions in 2007 and 2009…Was also recruited by Purdue, Colorado State, Kentucky, Tulane and Western Kentucky.\nE.J. Dunston, DT, 6-2, 308, Eatonville, Fla. / Edgewater\nPlayed for coach William Gierke at Edgewater High School…Enrolled for classes in January…Made 75 tackles and five sacks as a senior and was named an all-star…Recorded 100 tackles with 10 sacks as a junior and 50 tackles with five sacks as a sophomore…Helped Edgewater to district and regional championships as a sophomore and senior…Teammate of current Knights Quincy McDuffie and Henry Wright at Edgewater…Was also recruited by Florida State, Georgia Tech, Virginia and Duke.\nAndrew Rice, DT, 6-1, 280, Lake Mary, Fla. / Lake Mary\nPlayed for coach Scott Perry at Lake Mary High School… Ranked amongst the top 20 players in Central Florida by the Orlando Sentinel…Named all-conference in 2008 and 2009…Named Lake Mary’s Best Defensive Lineman…Made 59 tackles as a senior with 12 tackles for loss, three sacks, two forced fumbles and two recovered fumbles…Had 42 tackles and four sacks as a junior…Conference champion in wrestling…Named to the honor roll and won the Citizenship Award…Was also recruited by Purdue, Wake Forest, Iowa State, Colorado State, New Mexico, FIU, FAU and Troy.\nJordan Ozerities, DB, 5-10, 185, Mount Dora, Fla. / Mount Dora\nPlayed for coach Chad Grabowski at Mount Dora High School… Enrolled for classes in January…Named first-team All-Central Florida by the Orlando Sentinel…A four-time all-area and all-county pick…Named honorable mention all-state as a sophomore…Played in the Central Florida All-Star Game…Was also recruited by Kentucky, South Carolina, Georgia Tech, Stanford and Tulsa.\nCornelius Whitehead, WR, 6-1, 175, Mount Dora, Fla. / Mount Dora\nPlayed for coach Chad Grabowski at Mount Dora High School… Enrolled for classes in January…Named all-state as a senior…Ranked amongst the top 50 players in Central Florida by the Orlando Sentinel…Scored 21 touchdowns as a junior with over 900 combined receiving and rushing yards…Was also recruited by Florida, Florida State, Georgia and South Carolina.\n– The Miami Central Five –\nJeffrey Godfrey, QB, 5-11, 167, Miami, Fla. / Miami Central\nPlayed for coach Telly Lockette at Miami Central High School…Team was 12-2 in 2009, won the county championship and advanced to the FHSAA state semifinals for 6A… Enrolled for classes in January…Florida’s 6A Player of the Year…Named “Mr. Dade Football”…Played in the annual Dade-Broward All-Star Game…All-Dade four times…The leading passer in Miami-Dade County history with 7,251 yards, breaking the mark of Miami Northwestern’s Jacory Harris…Rated as the top quarterback in Florida and amongst the nation’s top 10 dual threat quarterbacks…Threw for 2,758 yards as a senior with 36 touchdowns…Also recruited by Florida State, Miami, Georgia, Tennessee, Michigan, Ohio State, Oregon, USF and FIU.\nJose Jose, DL, 6-2, 355, Miami, Fla. / Miami Central\nPlayed for coach Telly Lockette at Miami Central High School…Team was 12-2 in 2009, won the county championship and advanced to the FHSAA state semifinals for 6A…Twice named All-Dade County…Played at Booker T. Washington as a junior and was named first-team all-state…Played in the U.S.A. vs. the World All-Star Game…Ranked amongst the top 20 offensive linemen in the state by Bill Buchalter…Was also recruited by Florida, Miami, Rutgers, Tennessee, West Virginia and USF.\nJamar McClain, DB, 5-10, 175, Carol City, Fla. / Miami Central\nPlayed for coach Telly Lockette at Miami Central High School…Team was 12-2 in 2009, won the county championship and advanced to the FHSAA state semifinals for 6A…Named to the Miami Herald All-Dade County team…Had 46 solo tackles and five interceptions as a senior…As a junior, intercepted a pair of passes and had 430 receiving yards…Also made three interceptions as a sophomore…Was also recruited by Auburn and Memphis.\nJoshua Reese, WR, 6-1, 182, Miami, Fla. / Miami Central\nPlayed for coach Telly Lockette at Miami Central High School…Team was 12-2 in 2009, won the county championship and advanced to the FHSAA state semifinals for 6A…A two-time all-state pick who has been ranked amongst the top 25 recruits in Florida and the top 150 recruits in the nation…Named to the Miami Herald All-Dade County team in 2008 and 2009…The top receiver in Miami-Dade County, had 43 catches as a senior for 820 yards and eight touchdowns and 40 grabs as a junior for 793 yards and 10 touchdowns…Played in the Dade-Broward All-Star Game and the U.S.A. vs. the World All-Star Game…Also recruited by Florida, Florida State, Nebraska, USF, Nebraska, South Carolina, Tennessee and West Virginia.\nLeBranden Richardson, DE, 6-2, 223, Miami, Fla. / Miami Central\nPlayed for coach Telly Lockette at Miami Central High School…Team was 12-2 in 2009, won the county championship and advanced to the FHSAA state semifinals for 6A… Led Dade County in sacks and was named to the Miami Herald’s All-Dade team…Played in the annual Dade-Broward All-Star Game…Played in the U.S.A. vs. the World game…Had 92 tackles with 28 tacks, 30 tackles for loss, and nine forced fumbles…Was honorable mention all-conference at Hialeah High School in 2007 and 2008… Was also recruited by North Carolina.\n– More Florida Commits –\nJordan McCray, OL, 6-4, 290, Miami, Fla. / Southridge\nPlayed for coach Patrick Burrows at Southridge High School…Older brother, Cliff, played at UCF and was starting left guard in 2009…Team went undefeated in the 2009 regular season, winning the district championship, before losing in the state playoffs…Named All-Dade County as a senior by the Miami Herald after making 67 pancake blocks and not allowing a sack…Started 10 games as both a sophomore and a junior…Also qualified for the 6A state wrestling tournament as a sophomore…Member of the National Honors Society…Was also recruited by USF, Mississippi State, Tennessee, Rutgers, Miami, Illinois, Marshall and FAU.\nJustin McCray, OL, 6-4, 290, Miami, Fla. / Southridge\nPlayed for coach Patrick Burrows at Southridge High School…Older brother, Cliff, played at UCF and was starting left guard in 2009…Team went undefeated in the 2009 regular season, winning the district championship, before losing in the state playoffs…Named to the Miami Herald All-Dade County team as a senior for making 63 pancake blocks and not allowing a sack…Was district champion in wrestling as both a sophomore and junior…Member of the National Honors Society…Was also recruited by USF, Mississippi State, Tennessee, Rutgers, Miami, Illinois, Marshall and FAU.\nPerry Meiklejohn, OL, 6-3, 306, Miami, Fla. / Westminster Christian\nPlayed for coach Joe Mira at Westminster Christian… Enrolled for classes in January…Twice named All-Dade County…Team went 10-0 as a senior during the regular season and won the district championship…Was also recruited by Tennessee State.\nZach Soto, OL, 6-6, 278, Miami, Fla. / Monsignor Pace\nPlayed for coach Alvin Slaughter at Monsignor Pace High School…Named All-Dade County and played in the Dade-Broward All-Star Game…Also played in the Team USA vs. Hawaii All-Star Game…Made 64 pancake blocks as a senior after recording 55 as a sophomore…Named Dade County Scholar Athlete of the Year…Helped Monsignor Pace to a 2008 district and regional championship and a berth in the state semifinals…Also recruited by Mississippi State, Duke, FAU and Buffalo.\nTorrian Wilson, OL, 6-4, 315, Miami, Fla. / Miami Northwestern\nPlayed for coach Billy Rolle at Miami Northwestern High School…Rated as the eighth best offensive guard in the nation by Rivals.com…Was selected for the Under Armor All-American Game…A first-team all-state pick and an All-Dade County selection as well…Made 120 pancake blocks as a junior alone and recorded four sacks on defense…Was also recruited by Stanford, Louisville, Alabama, LSU, Tennessee, Michigan and USF.\nWoodley Cadet, DB, 6-2, 206, Loxahatchee, Fla. / Seminole Ridge\nPlayed for coach Matt Dickman at Seminole Ridge High School…Made 45 tackles (37 solo) as a senior with four deflected passes and an interception…Named first-team all-district, all-conference and all-area by both the Palm Beach Post and Sun Sentinel…Also played some at wide receiver…Made 32 tackles as a junior, 24 of them solos, with four interceptions to earn all-conference honors…Named to Bill Buchalter’s Florida Top 100 list…Also recruited by Illinois, Indiana, Wake Forest and FAU.\n– Five From Georgia –\nJordan Akins, WR, 6-4, 202, McDonough, Ga. / Union Grove\nPlayed for coach Steven Collins at Union Grove High School…An all-state selection in 2009 as a senior…Attended Strong Rock Christian as a junior and passed for 823 yards and 12 touchdowns while also rushing for 784 yards and 14 touchdowns to earn all-state honors…Named all-conference as a sophomore…Also considered a pro prospect in baseball as a centerfielder…Was also recruited by Georgia, LSU, Georgia Tech and Tennessee.\nQuenton Brown, DE, 6-3, 215, Lilburn, Ga. / Tucker\nPlayed for coach Franklin Stephens at Tucker High School… Helped Tucker to a 4A State Championship at 14-1…Made 68 tackles, 10 sacks and blocked five kicks as a senior…Recorded 67 tackles as a junior, including nine sacks and eight tackles for loss, while also catching 30 passes as a tight end for 400 yards and four touchdowns…Caught 27 more passes as a sophomore for 490 yards and four scores…Played in the North-South All-Star Game…Member of the National Honors Society…Tucker is also alma mater of current Knights Jonathan Davis and A.J. Bouye…Also recruited by Miami, Ole Miss, Michigan State, West Virginia and Marshall.\nTony Jacob, OL, 6-8, 310, Atlanta, Ga. / Westlake\nPlayed for coach Gregory Minnis at Westlake High School…Named first-team all-region as a senior…Had 31 pancake blocks in 2009 and graded out at 86-percent…A team co-captain who helped Westlake to the 2009 state playoffs…Earned Westlake basketball’s Rebound and Character Award as a junior on a team ranked in the national Top 25…An honor roll student and perfect attendance award recipient…Was also recruited by Alabama, Oklahoma State, Indiana, Middle Tennessee and Western Kentucky.\nCody Ralston, LB, 6-2, 196, Calhoun, Ga. / Calhoun\nPlayed for coach Hal Lamb at Calhoun High School…Was an honorable mention all-state pick for all classifications and a second-team all-state 2A pick…Missed much of 2009 due to injury but had 27 tackles, including two TFLs…Mad e42 tackles as a junior with four tackles for loss, three sacks, two interceptions, two fumble recoveries and a pair of touchdowns…Earned the team’s Captain’s Award in 2009 and the Iron man Award in 2008…Calhoun was the four-time regional champion and was twice the state runner-up….Was also recruited by Vanderbilt, Purdue and Middle Tennessee.\nJustin Tukes, TE, 6-5, 230, Sylvester, Ga. / Worth County\nPlayed for coach Scotty Ward at Worth County High School…Named all-region and all-metro as a senior…Selected for the Georgia vs. Florida Border War All-Star Game…Had 16 catches as a senior for 198 yards with three touchdowns…Also blocked a punt and made 14 tackles…Named to the all-region team as a sophomore and a junior as well…Caught a total of 22 passes as a sophomore and a junior combined for six touchdowns while also recording a total of 24 pancake blocks…Was also recruited by Louisville, UAB, Georgia State and Jacksonville State.\n– Two From South Carolina –\nDavious Chestnut, DB, 6-1, 185, Hemingway, S.C. / Carver’s Bay\nPlayed for coach James Thompson at Carvers Bay High School…Helped team to Lower State Championship in 2007 and 2008 and a 33-4 overall record from 2007-09…Twice named to the South Carolina all-state team…Named all-region in 2009 at both defensive back and running back…Thrice named all-region as a defensive back…Team MVP…Played in the Shrine Bowl of the Carolinas…On defense he led the team with three interceptions and had 48 tackles…Rushed for 1,078 yards with 18 touchdowns as a senior while making 68 tackles and four interceptions on defense.\nClayton Geathers, DB, 6-2, 190, Georgetown, S.C. / Carver’s Bay\nPlayed for coach James Thompson at Carvers Bay High School… Helped team to Lower State Championship in 2007 and 2008 and a 33-4 overall record from 2007-09 …Named all-state as a defensive back in 2009 and as a running back in 2008…Was the team’s Offensive MVP as a junior, rushing for over 1,500 yards with 23 touchdowns while also making four interceptions on defense…A three-time all-region pick…Played in the Shrine Bowl of the Carolinas…Was also recruited by South Carolina and Georgia.\nReprinted with permission of KnightNews.com’s sports partner, OrlandoSportsCentral.com. Visit OrlandoSportsCentral.com for more Knights sports news, plus all your local sports needs including: high school football, Orlando Magic and more!']",['https://knightnews.com/2010/02/ucf-football-recruiting-class-signing-day-knights-orlando/'],0.5848004221916199,0.14173418283462524,0.17428699135780334
